Name,Pick,Strengths,Weaknesses,Height,Weight,Age
Daniel Hamilton,56,"Extremely versatile wing player with good size…Hamilton averaged 9 RPG last season as a perimeter player, so he’s very tenacious in crashing the glass…Very willing passer with excellent vision for a player his size.  Hamilton averaged nearly 5 APG and was the set-up man on several alley-oops throughout the year as he drew defenders while driving to the basket, then fed the cutting big man on the baseline … Great finisher and creator in transition…Great size (6’7"") for a perimeter player, especially a potential shooting guard, and solid length (6’9"") wingspan which gives him some potential as a defender … He’s not great at getting to the rim, but he has an arsenal of floaters and turnaround jumpers that, combined with his size, allow him to score in the lane … Excellent FT shooter at 86%…Solid ball-handling at 6’7""… Streaky outside shooter who has the potential to become a very solid threat from behind the arc … Great feel for the game.  Hamilton is an instinctive scorer and passer and this will help him transition to the NBA more smoothly … Really hustles for rebounds and loose balls.  In most facets of the game, Hamilton’s energy level is very high…","Hamilton is an incredibly inefficient offensive player.  He shot a mere 42% inside the arc last season and his FG percentage was an abysmal 39% … His shot selection is often questionable in the half court … Lacks the blow by speed or the craftiness to get by his man or all they way to the rim with any consistency …  He often drives into a brick wall and has to throw up a tough shot … Despite his decent length, Hamilton is not  particularly great defender …  His lateral quickness is subpar, his effort appears lax as he’s often standing straight up, and his footwork is often awkward and he has to allow his ballhandler past him … Posted extremely underwhelming numbers at the combine, particularly in the max vertical leap, where his jump was the second-lowest … With his below-average athleticism, he struggles to create his own shot and has to rely on his jumpsuit, which is inconsistent … Extremely skinny.  Packs less than 200 lbs. onto his 6’8"" frame, which will likely cause him to get bullied at the NBA level … Great free throw shooter, but averaged just over 2 attempts per game in college, meaning his opportunities to shine from the line were very limited…",79,200,20.89
Wang Zhelin,57,"Skilled 7 footer who shows impressive maturity and confidence … Dominated the CBA (Chinese Basketball Association) in his rookie season averaging 20.3 ppg 12.9 rpg in 36.5 mpg …  Was top 5 in the CBA in Offensive Rebounding % with 16%, as the ones in-front of his where all american players … Has a good motor and consistently crashes the boards … Uses his strong, thick legs to get positioning and has good instincts grabbing rebounds and looks to finish or draw contact after offensive rebounds … Advanced footwork in the post most often gets him in scoring position where he can finish with both hands … Good, soft hands around the rim … Very patient in the post and uses a combination of pump fakes and spins instead of rushing up bad shots … Also likes to operate in the high-post where he favors driving left and spinning back over his left shoulder where he can finish with a right handed hook shot … Sets good screens and also does a good job taking up space  in the paint when teammates look to score … Will be the starting Center for China for many years to come …","Not overly athletic … Foot speed is rather slow as he uses strength and skill set to beat his defenders in China … Will have problems against better stronger players at the next level … Does not possess good leaping ability and is a slow repetitive jumper as he lands heavy … Not a shot blocker … Below average wingspan … Defensively his slow foot speed makes it difficult for him to guard the pick and roll but he does give good effort … Very inconsistent jump shot where he lacks confidence … An average 63% free-throw shooter, but looking at his shooting mechanics one would assume he is a better shooter … His potential looks limited as he already plays very mature",84,251,22.44
Abdel Nader,58,,,78,220,22.76
Isaiah Cousins,59,"Already an intriguing prospect, Cousins has shown even more versatility as a senior since sliding over to the point guard position for Oklahoma … Despite not playing the point since high school, Cousins has shown a good grasp of running a pick and roll, as well as setting up one of the premier scorers in the country … He’s dishing out a career high 4.6 assists and doing so with a 2.0 assist to turnover ratio … His A/TO ratio actually increased dramatically since transitioning from an off ball player … In Lon Kruger’s high tempo offense, he’s grown used to pushing the ball, which will suit him better in the NBA than many slower paced college offenses … He’s shown the ability to get into the lane and make good decisions whether it’s finishing with a floater, getting to the hoop, or kicking it out to a teammate on the perimeter … Cousins has a good fundamental understanding of how to run an offense, and is versatile enough to be perceived as a threat off the drive and on the perimeter … Speaking of the perimeter, Isaiah is also a very capable long range shooter who’s hit 125-260 thee pointers in his junior and senior seasons in Norman combined (43%). That kind of volume and consistency will serve him well at the next level … As an NBA combo guard, who will most likely line up at the PG spot, Isaiah has a 6’5.5’’ wingspan and sizes up at 6’3’’ in shoes … While quite undersized for a two, his senior year showcasing his skills at the point has opened up more possibilities for him at the next level … For an NBA point guard he’s slightly above average in terms of size … This also allows him to rebound well for a player of his stature (4.6 per game).","Isaiah can sometimes struggle in terms of shot selection, especially when creating for himself off the dribble … Going into Oklahoma’s Final 4 matchup versus Villanova, Cousins is shooting just .413% from the field, which is actually below his 3 point clip … A shaky shot selection, and tendencies to over penetrate and take a bad shot over length are a part of this issue … He’s also a surprisingly sub par free throw shooter (67%) … While a pretty well built 195 pounds, he could stand to gain some more strength to adapt defensively in the NBA … He has the size, and athletic ability to guard the point guard position, but continued work in the weight room will be a must …",76,190,22.3
Tyrone Wallace,60,"Lefty combo guard with above average athleticism and scoring ability … Shows versatility having played his junior year at the PG position after proving to be a efficient SG in his first two seasons … Has the size to play the 2-guard position and his ability to play some point helps his cause … Strong rebounder for a guard. 7.1 rebounds per game show that he’s both athletic and aggressive and a real plus for his analytical numbers … Aggressive attacking the basket … Excellent body control to finish drives at the basket. Good at finishing after contact with And 1s … Solid defender using his length and anticipation to play the passing lanes and gather steals … Gives the impression that he plays hard on both ends of the floor, with good defensive posture and effort … Very solid in the open floor when his speed and quickness and decision making are all above average … Has maintained a solid a/to ratio throughout his college career … Hard work in the gym has led to a vastly improved jumpshot. He knocks down nearly one per game and shows the ability to pull up off the dribble and create shots for himself … Excels with the ball in his hands … A very strong ball handler, comfortable in breaking pressure and facing on ball defenders … Also shows the ability to find teammates on drive and dishes with solid vision … Solid mid-range game, utilizing pump fakes and can even take defenders down on the block and create with his back to the basket …","Shot has been a major weakness to his game and while his form isn’t terrible, he must polish his mechanics and add more arc to his shot. Statistically, his shot is no better than it was as a sophomore, although he’s increased his volume and improved in a lot of other areas … 32% from the college 3 (0.8 makes on 2.7 attempts per game show he’s worked at it, and the from looks much better), his shooting isn’t a lost cause but will require hard work to extend it to NBA 3 point range. He’s much more of a ""scorer"" than shooter … Not a true point guard but has improved at facilitating, he doesn’t generally create offense for others … His career 59% FT shooting, and 61% as a junior displays his lack of great shooting ability. For some reason gets better rhythm shooting from the field … Positional question marks. Not a prototypical shooting guard prospect with his lack of great spot up shooting ability, but his versatility should help his cause … Could be a little more of a vocal leader …",77,205,22.05
Gary Payton II,-1,"Late bloomer with great athletic attributes…  Payton is a jack of all trade player at Oregon State where he can play any position 1 through 4 … He has been a statistical monster on the defensive end: Averaging 3 steals 7.5 rebounds and 1.3 blocks per game as a guard … Payton, like his dad, has his hands on nearly every entry pass, has an uncanny ability to shot block as a guard without fouling, and is a game changer defensive force that opponents must game plan for … On the offensive end Payton has a quick step and takes great angles when driving to the hoop leading to nearly a 50% field goal percentage … Getting to the hole is where he is most dangerous as he is very creative and skillful in absorbing contact and finishing strong to the hole … Explosive athlete at 6”3 he has the ability to catch and finish one handed and two handed alley oops … Payton has good form and rotation on his jump shot and has a developing mid range and long distance game.  While he is an older prospect Paton’s biggest strength is his strong work ethic: his havoc causing intensity on defense and his development over the course of this season is remarkable …  He has made great strides in his development into a lead guard as early on this season he was viewed more as a 2 -3 and has become more into a 1-2 combo guard which would be required at the next level … He is the star player on one of the surprise teams in the NCAAs as Oregon State was thought to be the doormat of the Pac 12 in preseason rankings and will be at worst NIT Bound …","As mentioned,  Payton is older than most of his competition at 22 years old having spent a prep season in Arizona limiting his potential upside for most analytics … To complicate things as a late bloomer he has limited experience playing at the elite level.  Furthermore his time spent in Utah Junior college has limited his exposure to scouts and to competition… Thus putting greater risk on an organization to see him perform at a consistent level…He needs to work on his ability to set teammates up and running a team averaging over 2 turnovers per game to only 3 assist per game …  Handles could be honed some in particular his left… His outside shooting is his biggest weakness… While rotation and release is clean on his shot his release speed and arc could use some refining… He has improved his free throw shooting from the JC by 15% but still is only at 67% for the season at Oregon State and is under 30% from 3 point range…",75,185,23.58
Anthony Barber,-1,"Possesses a lightning quick first step and the ability to blow by most defenders. One of the quickest if not the quickest PG on the college level …  Improving jump shot from both inside and outside the arc … Had a 40 made free throws in a row streak during junior year, and is hitting 87% on high volume, a tribute to his vastly improved shooting and dedication … Has become very adept at drawing fouls, hitting over 7.2 per game on 8.3 attempts per game … Quick hands on defense … Evolving into one of the better PGs in the country after struggling with efficiency early on in his career … Decent size and wingspan for the PG position … Great touch around the basket and an above average finisher at this point in his career … Ambidextrous. Great ball handler and can do so with both hands … Becoming a much better floor general and leader as opposed to just a scorer … Has good PG size, being measured at 6’2 with a 6’4 wingspan while in high school …","Body strength remains a concern as he lacks great ability to absorb contact … Gets bumped off of his path/spots and too easily … As a junior, he is still very light so he will probably always be on the thin side … Shot selection can still be an issue at times, though vastly improved … Has a tendency to try to do too much on offense instead of deferring to his teammates when necessary … Mechanics on jump shot aren’t great and his jumper is a little flat … Entry passes to the post aren’t great and doesn’t look there enough, whether naturally or by design … Still doesn’t necessarily make his teammates better all the time as he looks to score before all else … Came in college with some off court concerns but has matured by all accounts …",75,175,21.93
Wayne Selden,-1,"After two average seasons of collegiate basketball, Wayne Selden Jr. finally put together the kind of year many had believed he was capable of since he came out of high school. Wayne began to use his NBA positional size, which includes a 6’10’’ wingspan and a well-muscled 230 pound frame to finish at the rim. Selden shot a very impressive 71.3% at the rim (according to Hoop-Math.com) and many of his finishes were jaw dropping dunks while taking contact from defenders. As a sophomore, Wayne’s at the rim FG% was just 50%, so this massive jump was more of a mindset change, than any massive physical improvement. He also showcased more consistency on his jump shot, especially from deep where he shot .392% from 3 point range on 5 attempts per game. Selden has the size, and athletic ability to get his shot off at the NBA level, so this added consistency from deep will bode well on his next level roll. He’s also shown the ability to hit rhythm jumpers off the dribble from the mid-range, especially at the top of the key. While not a point guard, Selden is also a creative passer, and above average ball handler for a shooting guard. His 100 assists as a junior was a career high. Selden has the ability and desire to guard shooting guards and small forwards in the NBA. While he may struggle a little bit with lateral quickness on defense in the NBA, he’s extremely strong, and projects to be a capable defender at the next level. Wayne has also shown a lot of fire as a competitor, and showcased the ability to use his athleticism and size to make plays out of loose ball opportunities. Going hand in hand with his competitiveness, his highlight play ability often changed the game’s momentum and was also something that provided great value for the Jayhawks last season","Wayne’s most glaring weakness is his lack of free throw shooting. While his aggression as a slasher was a huge improvement, his 61% free throw clip left a lot of points on the board. His mechanics are not anything to fret over, but this block at the foul stripe seems to be more of a mental block than anything. Selden is a tremendous athlete with strength, end to end speed, and leaping ability; however, his lateral quickness isn’t quite up to par with the rest of his athletic package. His large wingspan and ability to body up can make up for this, but it may cause him some issues defending at the next level. While he did show great improvement as a junior, he’ll still need to hone is all around game to find playing time in the NBA. His foundation is there, and now that he’s finishing at the hoop and hitting a higher clip of 3 pointers, he’s got NBA value, he’s just going to need to continue to work to get major minutes on an NBA roster.",77,230,21.75
Perry Ellis,-1,"Solid, but not overly impressive, 6-foot-10 wingspan for his height (6-foot-8 1/4 w/shoes) … Does have the necessary strength to play physical with stretch power forwards … Took major strides as a scorer over the course of his collegiate career … Improved on his scoring efficiency (61 percent true shooting as a senior) … Is more comfortable with his jumper at this point than ever before … Has become a much improved three-point shooter over the course of his collegiate career (although his sample size isn’t that big) … Very accurate shooter from mid-range … A skilled offensive player in the post/on the block with his back to the basket … Shows great balance when making his moves in the paint … Isn’t afraid to take on post defenders one-on-one … Demonstrates great footwork and touch around the basket … His go-to move in the post is a spin move over his left shoulder followed by a jump hook … Is effective finishing off pick-and-rolls and cuts to the basket … Operates well in space…Has improved ball-handling…Has a face-up game … Very good taking slower defenders off the dribble as a straight line driver (quick first step) … Attacks his defenders hips well … Capable of penetrating from the mid-range … Ellis is a smart defender in that he always seems to rotate to the right spots on the floor (terrific positioning and slides his feet well) … Ranked fourth in adjusted defensive efficiency last season with the Jayhawks … Good anticipation skills…Has a knack for drawing charges … He shows a nice feel for the game on the defensive end and is a great team defender … Very aware help defender … Although rebounding isn’t a real strength of his, he does make an effort in this area by boxing out and creating space for his teammates to corral loose balls … Ellis is very competitive and has a great basketball IQ … A willing passer who sees the floor well although that’s not a major part of his game … Turned in the second-fastest three-quarter sprint time among all players at the NBA Draft Combine…","Not sure what position he’ll be most effective at in the NBA (small forward or power forward) … Just an average athlete at best … Does not have spectacular physical tools and has a small frame (a bit of a tweener at 218 pounds) … Limited foot speed which doesn’t bode well it comes to matching up with quicker perimeter players at the next level (since he’ll most likely be a combo-forward) … Although he’s skilled in the post, he won’t overpower anyone…He’s gotten better at attacking shot-blockers and scoring over length at the rim but that has always been a struggle for him…Has to continue to show that there is more to his offensive game … His go-to moves were predictable…Defenders can make it very tough for him if they defend his left shoulder well, stop his spin, and take away air space when he catches the ball…He’s not a great creator offensively when playing on the wing … Has impressed scouts with his ability to hit the college three but questions still linger about his capability to knock down NBA threes … Can he become a threat at the next level when it comes to his spot-up shooting?…Struggles with creating after catching beyond the arc (i.e. attacking closeouts, taking multiple dribbles into the paint to get to the basket, finding open teammates) … Questions about how effective he can be as a perimeter player in the NBA, which is very important for him to improve on … Isn’t really known for his passing (averaged just 1.7 assists per 40 minutes) … Will often get tunnel vision when looking to score and doesn’t look to pass to teammates … Needs to work on not losing his confidence if he struggles with his scoring early on in a game … Lack of physical tools somewhat limits his abilities on the defensive end…Will need to figure out which position he’ll be capable of guarding on a consistent basis … Lack of foot speed, height and length will work against his effectiveness as a post defender … Needs to improve on his defensive footwork in order to become more equip of staying in front of quicker, penetrating perimeter players … Because he doesn’t have the necessary footwork in this area, he often has to give himself enough space between him and his man so that he isn’t easily beat off the dribble…As a result, he tends to allow too many open jumpers … Defensive rebounding isn’t one of his strong suits … Ellis doesn’t have the athleticism, physical tools, or leaping ability to consistently beat his opposition on the boards (off the rim or loose balls) …",80,220,22.79
Zach Auguste,-1,"A big, strong, athletic big man prospect, who has a smoothness to his game … Superb athleticism and surprising ball handling ability and footwork make Auguste a deft face-up power forward prospect … He punishes the rim with his dunks, and he’s been known to attack the rim from all the way on the perimeter as well as take the ball up the floor himself on the fast break … His athleticism and tenacity also make him a very good rebounder, as he averaged over 10 boards a game last season…Shot a whopping 56% from the field last season…Great at getting putbacks and tip-ins around the rim…Shows soft hands catching entry passes and finishing alley-oops.  Excellent pick-and-roll player…Good at coming over from the weak side to block shots …","Very limited offensively.  He can get to the basket and he can finish above the rim, but he has very few post moves, nor does he have any kind of range on his jumper … Might be more inclined to play center, but at 6’10"", he doesn’t have the size to do so, and as is, may get pushed off the block at times guarding NBA 4’s … This could very well be indicative of an inability to make the transition to matching up with NBA bigs, as his athleticism and decent size won’t be nearly as big of an advantage … Statistically, Auguste is a good rebounder, but that skill may not translate as well as NBA defenders may have a much easier time boxing him out … Often plays too passively on the offensive end, although he made an impact much more consistently this past season…Not a particularly sound defender, either in the post, or on the perimeter…Will turn 23 in July, which is very undesirable for a man his size…",82,240,22.98
Danuel House,-1,"Smooth shooting stroke … Shot 34% for his career from 3, including 40% his junior year … Strong frame and decent explosiveness makes House a capable slasher … Good leaping ability and excellent speed make him a strong finisher in transition … Good shooter off the dribble … Has the athleticism to finish above the rim in some situations … His length/strength combination will allow him to match up with NBA-size 3’s … Has put on 30-40 pounds of muscle since entering high school … Gets to the line at a decent rate, where he was a 72% shooter last season … May have a role in the NBA as a serviceable 3-and-D guy due to his potential as a shooter and defender … Form on jumpshot","House isn’t a very good ballhandler and struggles to create his own shot and finish at the rim with consistency … Not a very committed defender.  He has decent quickness and strength, but his length and lack of great fundamentals limit his production … Outside shooting took a steep drop this past season, from 40% to 31% … At age 23, House’s potential for development is low…",79,215,23.06
Troy Williams,-1,"He’s an athletic wing with a non-stop motor … He plays above the rim and is good for at least one highlight reel above the rim play in every game … He’s a tenacious and versatile defender … He can guard multiple positions … Has gotten stronger and more physical in his three years at Indiana … He excels when he runs the floor and fills the lane … He was a positive teammate on and off the court … Hustles and scraps for every loose ball, never lacking for effort … His midrange shot (10-15 feet) has shown improvement over the last three years … He went from a 20.7% three point shooter his freshman year to 34.7% his junior year … If he understands that it would be in his best interest concentrating on defense and rebounding, he can make an impact on a team …","He’s very inconsistent and that’s been for three years … He’s gotten better from three point range, but still inconsistent and happens to take them at the wrong time … Ball handling ability has improved, but is still sloppy, and is the root of his turnover problems …  Can be a little overeager defensively and leave his feet on pump fakes … All though not foul prone, he has a tendency to make bad fouls … Needs to improve his consistency on a game to game basis … Disappeared too much. Nine single digit games and two were a zero and a two point game. That’s too many for a junior with his talent … He needs to play with a better pace, he tends to get out of control very quickly … Sometimes it’s hard for college stars to understand they’re going to be role players in the pros, that question is still in the air for Troy …",79,215,21.49
