Name,Pick,Strengths,Weaknesses,Height,Weight,Age
Caris LeVert,20,"Excellent scoring guard with good size and athleticism …Very good shooter.  Knocked down 45% of his 3’s last season, and has a very smooth stroke … At 6’7"" with a 6’10"" wingspan, LeVert has great size and length for a shooting guard … He uses it to disrupt the passing lanes and shooter over smaller defenders … Solid ballhandler.  Definitely has substantial shot-creating ability … Great court vision.  Excellent passer …  Averaged 5 APG last season …  Very instinctive offensive player, both as a scorer and a distributor … Smooth finisher at the rim, and can elevate above defenders when finishing … Great catch-and-shoot player with a solid stepback jumper … Thanks to his length and athleticism, he’s a solid rebounding guard … Great in transition thanks to his athleticism, finishing ability, and court vision … Takes smart shots, as evidenced by his 50% FG percentage … Good leader during his time at Michigan …",Has had 3 surgeries on the same place in his foot in 22 months … Already has a reputation for being injury-prone …  Has dealt with foot/ankle problems throughout his career at UM … Skinny frame … Could get bullied by stronger shooting guards and may have trouble finishing inside … Will have to find his niche as more of a catch-and-shoot player … Inconsistent shooting off the dribble…,79,190,21.84
DeAndre Bembry,21,"A flashy, athletic wing with a flare for making highlight plays … An explosive player with a big wingspan … Very fast and thrives in transition … A smooth athlete who excels in the open floor, both with the ball or filling the lane … Has the shake and wiggle to get by defenders in ISO and create shots in the lane or at the rim … Quick first step … Excellent finisher … Gets his feet organized quickly when attacking the basket, and eludes defenders skillfully to create openings to the rim … Has a polished Euro-step he utilizes to get more extension on his drives … Loves to go for the dunk over defenders and often converts spectacular finishes … Good vision and passing skills … Had the ball in his hands a lot and is good at finding teammates off the bounce … Has a good feel for the game, and values the ball well, limiting turnovers … Led St. Joes in assists by a wide margin. Tremendous A/TO ratio 4.5/2.0 … Big hands allow him to palm the ball and grab rebounds or loose balls with ease … Solid ball handler, comfortable pushing the ball in transition … Has a lot of swagger and doesn’t lack for confidence … Aggressive scorer … Quality rebounder at near 8 per game … Makes a lot of creative plays around the rim, utilizing his leaping ability, length and body control … Has a lot of potential if he can improve upon his shooting efficiency and defensive assertiveness …","Offensive shooting efficiency is a major concern … Shot just 26.6% from 3 and 65.7% from the free throw line. His efficiency should improve in time thanks to a solid shooting form, but poor efficiency is definitely a cause for concern considering he’s a junior going on 22 in July … While he shows flashes of NBA athleticism, he’s far from a finished product … Defensive intensity and technique need work … While he gets a lot of steals and is active in passing lanes, he often falls asleep in ISO situations allowing his opponent to get by him. He then ends up gambling for the steal or block, which leads to fouls … Has solid potential as a defender, but it’s a big concern at the moment as it is more Swiss cheese than Cheddar … Needs to learn to play with the same energy and focus defensively as he puts into the offensive end … Despite being listed at 210 lbs, his frame does appear a little weak and that he could use added upper body strength … Decision making is a little wild at times as he will force shots and over penetrate … Does not lack for confidence, but at times, it can lead to poor shot selection … Must improve in the half court set in creating offense … Doesn’t have a clearcut NBA position as he lacks shooting for a 2 and size for a 3, but should figure things out with his above average speed and athleticism …",77,205,21.99
Malachi Richardson,22,"Nice size and well-built at 6-foot-6, which is prototypical for an NBA 2-guard … Long and athletic … Wingspan is a massive 7-foot … Has the potential to fill out his frame nicely … Versatile player, especially on the offensive end … Has a smoothness to his game … Capable of getting hot from three when in rhythm … Can shoot off the dribble with his feet set … Has an effective one-dribble (with either hand) pull-up jumper … Has solid scoring instincts … Capable of taking his man off the dribble … Loves to take advantage of one-on-one situations … Attacking style offensive player, making him a consistent threat to get to the rim … Good at finding ways to slash and slither his way to the basket and finish … When he gets to the rim, he’s shown that he can finish in traffic and with either hand … He can also finish through contact … Effective scorer/finisher in transition … Has a nice burst off the dribble … Can play above the rim … Has shown that he can facilitate an offense in the half-court … His passing ability is a bit underrated … Makes good use of an array or ball fakes … Shows good lateral quickness on the defensive end … His length, athleticism and competitiveness/effort makes him a great defender on the perimeter … Does a great job playing the passing lanes and forcing turnovers … Plays with passion and a high effort level … Has a strong work ethic … Even as a freshman, he displayed good leadership qualities and often led his teammates by example …","He can be very inconsistent with his offensive production … Nice athlete, but not ""standout"" … Not as explosive as his counterparts … Ball-handling can improve, especially in the half-court … Improvement in his ball-handling with help him with getting all the way to the basket more consistently on his drives … Needs to work more on driving and finishing with his left hand … Shooting form/stroke looks unorthodox at times … Instead of shooting the ball he tends to fling it … Release point should be higher … For being such a streaky and inconsistent shooter, he  sometimes relies on his jump shot too heavily … Prone to going ice cold from the field and disappearing offensively during games … Shooting efficiency needs improvement … Doesn’t always show that he has a good feel for the game … Richardson will force the issue on some possessions … Leading to silly turnovers and bad shot selections … Needs to work on getting good shots off within the flow of his team’s offense … Overall decision-making needs to improve … A few years older than most players in his class because he reclassified …",78,200,20.48
Ante Zizic,23,"Solid Wingspan (measured at 7-3 feet)… His long arms help him be effective on both ends of the floor… Runs the floor well for a Big … Solid athlete … Very active and energetic type of player … Has a high motor and always plays 100% … Considered a hard worker …  When he has time to gather he can finish strong at the rim … Can play above the rim … Not only he is not afraid of contact, but he is actually looking for it on both ends of the floor … Relentless rebounder on both ends of the floor … Maybe the best rebounder of his generation in Europe … Has a great feel of positioning which helps him to gather rebounds … Can establish deep position in the post … Improving post game, with a right-hand Jump hook as a go-to move … Can turn over both shoulders when he plays with his back to the basket … Moves well without the ball … Effective on Pick and Roll situations … Always rolls hard to the basket after he sets a screen … Has soft hands and makes difficult catches in traffic and on the move … He gets to the free throw line at a very high rate (almost 8 attempts per 36 minutes in Adriatic League) … Solid Free throw shooter … Ft% and Shooting mechanics suggest that he has a lot of potential with his jump shot out to 18 feet if he continues to work … Willing defender … Can guard the Pick And Roll at an acceptable rate … A good shot-blocker, thanks to his long arms and good timing … Already knows that is essential to jump vertical when defending, making it difficult for opponents to score in front of him … Active hands and feet on defense … Solid off-ball defender …","Good but not great size for a center … Not a versatile player, since he can only play at the center position … Considered an average athlete by NBA standards … Has to continue bulking up his body … The fact that he needs time to gather before jumping can really hurt him at the next level … His footwork needs work on both ends of the floor … He might not be afraid of contact, but in reality he has problems against bigger and more athletic bigs … Has problems finishing through traffic … Not as adept at finishing at the rim with his left hand … His post game is mostly dependant upon strength and needs polishing … Although he can turn to both shoulders when he plays with his back to the basket, the truth is that he actually doesn’t have many counter moves … For the time being he can’t be considered a threat from mid-range… He doesn’t have a Face to the basket game… At times he tries to do things too fast, which leads to bad decisions… Feel for the game is a question mark … Has to improve his ball handling …Turnover prone (3.4 turnovers per 36 minutes in Adriatic League) … Bad passer (barely averages 0.5 assists per 36 minutes in Adriatic League)… His Assist/Turnover Ratio is bad (1 assist every 6 turnovers in Adriatic League) … When he sets screens on Pick And Roll situations he has the tendency to roll at the wrong side … Lateral quickness is average … Struggles defending the Pick And Roll against quick guards … Occasionally loses concentration on Defense, because he is too focused on the ball … It’s difficult to imagine him become an elite rim protector because of his average size and athleticism …",83,250,19.48
Timothe Luwawu,24,"Versatile wing … Great size and wingspan (measured around 7 feet) for his position … Has NBA level athleticism … Explosive leaper … Jumps equally well with either foot … Can play above the rim … Runs the floor really fast, helped by his great stride … Possesses good scoring instincts … Shooting mechanics have polished through time … Improving shooter in catch and shoot situations … Good shooter coming of screens … Can attack closeouts with his great first step … At the time he is better when driving and finishes in straight lines … Has potential to finish through contact if he bulks up his body … Occasionally can create his own shot … Excellent in transition … Can either start the break, or fill the lanes as a wing … Ball handling is much better than it used to be … Can play the Pick and Roll at an acceptable level as the ball handler … Willing to post up smaller defenders … He is a good slasher … Has a nice court vision, which helps him make good passes … Good rebounder for his position … Can guard multiple positions … Very good lateral quickness … Active hands on defense … Really knows how to fill the lanes and make steals … Has all the necessary tools (length, athleticism, lateral quickness) to become a lockdown defender in the future … Not afraid to shoot when the game is on the line …","Has to bulk up to be able to play at the next level … He has great numbers, but that is also a result of the high tempo of Mega Leks, which helps players showcase their skills … There are doubts about how his game will translate in the NBA …Can’t finish through contact yet, so at time he looks like he prefers to avoid it if he can, which translates to bad finishing ability at the rim … He might have improved as a shooter, but he can’t be considered a consistent threat from the perimeter yet … His shooting release is quicker than it used to be, but it remains pretty low and his shot can be blocked …  His follow through remains inconsistent at times … His ball handling still needs work … His ISO game is still a work in progress mainly due to his average ball handling … He lacks an in-between game … Must improve his shooting of the dribble, which is below average … His decision making isn’t there yet … Has the tendency to keep the ball in his hands for more time than he has to and take bad shoots … He seems to prefer shooting after first he has caught the ball with his left hand, which can easily been read by the defense … He has the bad habit of “disappearing” from time to time in the game … Drives almost always in straight lines, without much shake and having at times “tunnel vision” … He can’t “read” double-teams and help defense coming his way … Turnover prone … Must improve in pick and roll situations… His back to the basket game is still in its early stages … His defense is inconsistent … Defensive I.Q must improve … His off the ball defense is mediocre, mainly because he is too focused on the ball …",79,195,21.14
Brice Johnson,25,"The 6-foot-9, 225-pound Johnson has the perfect mix of scoring instincts, size, and mobility … He’s a long, wiry, and top level athlete with great athleticism … His game is very efficient … He maintains a high-efficiency rate no matter if his usage rate is up or down from game-to-game … Doesn’t force the issue offensively and plays within himself … He’s a player who opts to take good shots …. As a result, he shoots a high percentage from the field … Very effective as a scorer around the basket and at the rim (scores on put backs and alley oops) … A skilled finisher around the rim and seems to have a knack for being at the right place at the right time … Possess a soft touch on his jumpers and around the rim … Explosive in the open court … Gets out on the fast break and runs the floor extremely well … Very mobile/agile and coordinated for a player his size … Can outrun other bigs in transition and beat them to open spots where he can easily score … Loves to play above the rim and is aided by his quick leaping abilities …Very good dunker … He has a reliable 15-foot jump shot … Shows a good form and high release … Looks capable of expanding his range even further … Uses the glass nicely on some of his jumpers … Has made significant strides in his free throw shooting to this point (shot 57 percent as a freshman and is currently shooting 80 percent as a senior) … Shows consistency in rebounding his own misses … Tremendous second leaper … Defensively, his length, explosiveness, and quickness give him great potential … Moves well enough for his size … He can lock up his opponents when he’s fully engaged on the defensive end … Has improved as a shot blocker … Has really nice upside overall … A very dependable and reliable player on both ends of the floor … Has a mature game and high IQ …","He’s built into his frame quiet nicely since arriving at UNC in 2012, but continuing to add strength and bulk will be a major area of focus so that he can hold his own at the next level … It remains to be seen if he can develop into a consistent floor spacer; as almost all of his offensive production comes inside the paint … Shows some reluctance to shoot outside the paint at times … Not sure if he’ll be as much of a back-to-basket player at the next level due to his wiry frame … Can continue to show improvement in his feel for the game, meaning his court vision and passing ability … Doing so will allow teams to operate their offense through him outside of the paint and on the perimeter … Puts up strong rebounding numbers but he’ll sometimes shy away from physical contact on the boards … Has to continue to work harder on boxing out his opponents … He relies heavily on his length, quickness and instincts when going after loose balls; at the next level, he may not be able to rely only on these tools to be the elite rebounder he is at the college level … Johnson’s instincts on the defensive end could show improvement as well … Gets caught biting on pump fakes often … Sometimes looks to be out of sync with what’s happening on the floor … Close out speed and technique needs work … Struggles to defend quicker players outside of the paint … Gets in foul trouble easily when defending stronger players in the post because of his skinny frame … Needs to work on consistently defending in a low stance … Needs to work on keeping his intensity level up on defense …",82,210,22.01
Furkan Korkmaz,26,"Korkmaz can be described as a natural born scorer … This type of player is the dream of every coach … He has almost everything in the offensive dimension of the game and rarely struggle to create a score option to himself … He is a sharp shooter with a high percentage behind the arc … He averaged almost 50% in the latest U19 World championships and did so by utilizing shots within the team system … His shooting skill is simply outstanding … He never ies away from shooting the ball when he is open … This can be around the basket, mid range shots or three pointers … Especially when he is matched up with slower and shorter opponents, he has many ways to get open looks … It is hard to find someone who is polished making off-screen shots nowadays in youth tournaments but Korkmaz is a special type of player who is adept in this … He handles the ball well and this is what he improved upon in the last year … It looks like he has had good practice habits because now he has better command of his hands than before … Athleticism and physical tools of European players are generally the biggest question mark in NBA GMs minds … When we have a look at Korkmaz’ athleticism, it is easy to see that he will be able to cope with NBA players … His athleticism is one step above his peers … His agility and jumping skills allow him to complete highlight dunks … His athleticism is not like the Hezonja’s, but formidable it his own right … He is tall for his position and this causes mismatches for his opponent’s team … Even though he is taller than most of the guys who play his position, he doesn’t have any problem with speed… He is an agile player who is doing individual training to become more agile … He knows the game very well and has very great fundamentals. He loves to take the ball coast to coast, after a rebound … He’s very aggressive in looking for penetration towards the basket thanks to his agility and speed … He is a smart player, always thinking on the floor .. He always seeks mismatches and how to exploit the defense … In addition to his scoring ability, he is good at finding the right passing channels and extremely unselfish … Embraces a leadership role and accepts responsibility for the team’s fate … Has learned to become a kid with a strong work either over the years. You would not be able to say that two years ago, which is a great development … He has shown great improvement in his all around game … He was not a good penetrator two years ago but now when he finds an opening in the defense, he never avoids driving to the basket … That’s why he is a high level prospect. He is continually improving his game … Has experience. He has already competed at the senior level (around some of the best players in Europe) and the experience factor is important in the development process of his game … He will not be like a fish out of water when he sets foot in the NBA which is a common thing among European players. An 18 year old player with real Euroleague experience is not a common thing.","His defense is the developing part of his game … It is hard to say that he is a bad player defensively. On the contrary, he has quick hands and has nice steal stats in every tournament, but he needs to bulk a little bit to be effective at the NBA level … Some opponents are able to effectively play post up against him … He needs to gain weight for not just his defense but in order to become a more explosive player … We saw the same case in Hezonja’s development … Korkmaz has a good frame, and is going to have balanced and fit body when he put the work in in gym  … Still has a tendency to disappear during games, although I know he has the clutch gene to rise when it matters … Maybe he is doing this because of the fact that the team has other talents with more consistency at this point … But a steady level of play will be an important addition for his game …",79,175,19.0
Pascal Siakam,27,"A high energy four with great length (7-foot-3 wingspan) and solid all around skill set … Had a highly productive season at New Mexico State putting up 20 and 11.6 as a sophomore … Shows tremendous defensive ability, utilizing his huge wingspan and quickness … Very fast in the open floor and will outwork his opponent, hustling down the floor on every possession … On top of being a high level run jump athlete, shows great lateral speed … Was very effective guarding both on the perimeter and in the post … Can legitimately stay in front of guards out on the perimeter, which is unuaual for a 6-9 forward … Does a good job of staying down and not biting on fakes. Blocks a lot of shots without even leaving his feet, utilizing strong fundamentals by not reaching and putting his arms stright up … Gives great focus and energy on the defnsive end and causes havoc for offensive schemes with his great length … A high level rebounder who goes hard for every ball and utilizes his big hands and long arms to secure rebounds in and out of his area. At 11.6 rpg, was 8th overall in the country in rebounding … Offensive game has shown solid improvement. He’s comfortable creating shots on the block and has an effective hook shot … Shows the ability to attack the basket and good ball handling ability … Shooting efficiency is solid as he hit over 70% from the line in college (76% as a FR and 68% as a SO) and did a solid job of getting to the line (5.9 FT attempts per game) … His 44% on shots from the perimeter (where 60% of his looks came from), while not tremendous, is also not bad and shows that his game is not solely predicated on getting to the rim as is the case with some 4s … Figures to be an energy four giving defense and rebounding while his offensive polish develops …","Playing in a mid-major, it will be tougher to convince teams that his numbers were legitimate and not enhanced by the level of competition … Turned 22 in January so there is some question about his upside, though his overall skill set and feel for the game is solid … His offensive game is a little unorthodox … At times his post skills can be too predictable as he often likes to go over his left shoulder on the block … Should look to develop a few go to moves and improve upon his footwork … Needs to add some upper body strength, though he has good strength (226.6 lbs) considering his weight and plays through contact well … While he has solid form and touch on his shot, he could stand to adjust his form some as he tends to shoot with his right elbow out and leans into shots … Not an elite level leaper, though solid … Could be a little more aggressive in attacking the rim for dunks … Not a rim protector or a big shot blocker (2.2 per game) considering his length, but could become better if he develops his technique and timing …",81,230,22.4
