Name,Pick,Strengths,Weaknesses,Height,Weight,Age
Chinanu Onuaku,37,"Center with a strong frame, especially given his age, who was a defensive force when he was on the floor for Louisville … With a 7’2.75” wingspan and over 9’0” standing reach, along with weighing in at 245 lbs, measures in at around or above average for a post … Moves feet quite well for a big man and covers a lot of ground on defense … Load to move down low, showed improvement as a post player … Will make rim runs, has a decent stride to him and definitely has the strength to battle inside, along with potential to increase his already impressive girth … Was a valuable rim protector, shows good timing as a shot blocker and is quite good at playing with his arms straight up … Also had a pretty nice steal rate for a big man, makes a lot of plays defensively … Factor on the offensive boards, works hard and knows how to use his body … Willing to do a lot of the things you want your big man to do, to the point of shooting FT’s underhanded in hopes of improvement, as he went from 46.7% FT as a freshman to 58.9% FT as a sophomore … While his hands are not very big at his size, does have a quick reaction time, which enables him to do things faster than most centers … Showed very nice vision, which makes up for his limitations as a shooter and lack of creativity as a post player … Also a strong defensive rebounder, closes out possessions to go along with knowledge of how to alter shots without getting moved far out of position … Ability to make decisions on the move sets him apart from a vast number of young big men … Finished a high amount of his attempts near the rim … His ability in the pick-and-roll, playing off the ball, also show signs of being a good teammate … Still only 19-years old, does not turn 20 until November and already possesses strength that sets him apart","Quite limited offensively, has not shown much ability to stretch the floor or post moves … Lacks speed to do much off of the dribble or the footwork to consistently pose much of an issue once he has the ball on the block … Plays very upright, which sometimes causes him to get pushed off balance … Still a rather poor FT shooter, who did not get to the line very often … With the NBA now leaning towards the “hack-a-whoever” mode, will still be a possible liability on the floor offensively … Will gamble and make some bad decisions as a passer, very high turnover rate given his usage rate … Gambles and uses his hands a lot as a defender, resulting in foul trouble on quite a number of occasions … Not an explosive leaper, will likely have a much more difficult time finishing and challenging at the rim in the NBA … Conditioning will be something he needs to develop in the NBA, can lose some focus when he is tired … While he runs alright, still not particularly fast and will have a tough time staying in front of quicker players … Measured with only 8.00” hand width, among the smallest at the NBA Draft Combine in 2016 … Averaged only 7 FGA’s per game and played just 24.6 mpg, expecting him to do much more than that will take quite a while … Was not cleared to begin private workouts with teams close to the NBA Draft Combine as it was discovered he had a heart rhythm issue known as “Wolf-Parkinson-White syndrome”, which required surgery and will definitely be something that should be monitored",82,245,19.65
Patrick McCaw,38,"Has great size for a NBA shooting guard. Measured at 6’5.25 barefoot with a 6’10"" wingspan … An athletic guard that has the speed and quickness to be an excellent two-way player … With his combination of size, length, quick hands and lateral quickness, Pat is a ball hawk on defense, especially on the perimeter … He does a good job of getting into a low defensive stance which allows him to be aggressive on the ball, active in passing lanes and create turnovers which leads to easy transition points … He was one of the nation’s best on ball defenders … He averaged 2.5 steals per 40 minutes … Solid assist to turnover ratio at 3.9 to 2.1 … Has the versatility to guard the 1, 2 and 3 positions … With good speed, quickness, nice handles and a good feel for the game, he excels in transition … Even though he’s not viewed as a bucket getter, Pat showed flashes in his two years at UNLV that he can score coming off screens, using runners, floaters and shooting 3s off the dribble … Shows a lightning quick first step and tremendous speed to get to the rim off the dribble … As a freshman he led the team with 57 made 3s … Has excellent shooting mechanics which will translate to the NBA level … He a very poised player and has a passion for competing and is known for hitting big shots … Has the potential to be a versatile offensive player … McCaw’s court vision, feel for the game and a natural passing ability allow him to find cutters, throw lobs and be very effective in the pick and roll situation … As a FR when fellow FR teammate Rashad Vaughn went down with a knee injury, McCaw took over the scoring burden and shot 40% from the 3-point line … He has the potential to be a knock down shooter at the next level … Shines in the clutch and wants the ball in end of game situations … In his two years at UNLV, Pat hit a number of big shots when the game was on the line, which shows his competitiveness and will to win … With his size, has the versatility to play multiple positions, PG, SG and SF … Should be an excellent player in a complimentary role …","At 180 lbs, McCaw is one of the lighter players in the draft … He gets knocked off balance too easily when coming off of screens and due to his lack of muscle, struggles with the physicality of the game … Needs to focus on putting on weight and getting stronger which will help him with his mid-range game and finishing around the basket with contact … Not a good post defender … While his versatility to play multiple positions can be looked at as a positive, his lack of a natural position could be viewed as a negative … At times can be careless with the basketball due to high dribble … Can be undisciplined at times gambling for steals … Has room to grow in terms of consistency when scoring around the basket. For somebody that’s 6’7, he should work on his post game, which will allow him to post up small guards at the next level … Not a kid with a strong personality and tends to prefer to lead by example than be talkative. Should look to become more assertive and vocal …",78,180,20.68
David Michineau,39,"As a 6-4 PG, with a 6-5 wingspan, he has very good size for the position and a solid frame on which he can put on some additional muscle … This is combined with impressive speed and athleticism … By European standards, he’s really explosive, plays above the rim, and has a very fast first step … He’s able to use his quickness in the half-court game to beat the his defender and is really effective in transition … His shot mechanics are improved and he definitely has shown range and a reliable pull-up jumper … Shows solid passing instincts, unselfish, and looks for teammates when the defense collapses after his first step … His athletic skills can be used on the defensive side, where he puts pressure on opponents and makes quick recoveries and closeouts … Still seems to be improving and could have some upside left to develop in terms of skills: Ball handling and passing are average but show room for improvement …","At 180 lbs, he’s still skinny, and needs to put some time into the weight room, and add strength, especially to his upper body … He lacks elite court vision and his decision-making definitely needs improvement, including pace management during the game … This is leading to frequent turnovers, which are often higher than his assists … Definitely not a pass first point guard since he tends to force shots and rely too much on his outside shot, which is definitely inconsistent. Will need to become a better vocal leader …",76,180,22.06
Diamond Stone,40,"Smooth freshman big with nice combination of size, strength and skill … Very sure-handed player, catches almost every pass thrown his way … Can snatch rebounds away from opponents’ in traffic … Has a very long reach (7’3.5"" wingspan) … Well put together physically at 6’11"" and 255 lbs … Solid athlete with a quick second jump … Runs the floor well for a big man … Possesses good footwork in the post … His drop step is a very capable go-to move at the next level … Already developed a good range of interior offense … Understands how to finish below the rim well … Has a great blend of strength and agility to his game … Will often take advantage of a mismatch by playing ""Bully Ball"" against smaller defenders … Good free throw shooter shooting at an 80 percent clip … Has shown that he is also a threat in pick and pop plays … Nice form on his shooting mechanics could possibly extend range to NBA three with practice… Does a good job of not giving ground to his man as a post defender … His length can cause opposing players to alter their shots at the rim … Has the tools to become an effective defender against perimeter players in pick and roll defense … When fully locked in has a junkyard dog type quality and ferocity to his play … Confident player who believes in his abilities …","Despite being very good at a young age, his upside is limited to a degree by his lack of great athletic ability … Attitude is at best ""immature"" … Can often be caught drifting or sleepwalking through numerous possessions … Developed a bad reputation for his practice habits early in his college career … Too often his motor runs hot and cold … If the offense isn’t running through him, do not expect him to give great effort or make much of an impact … Will lose focus and let smaller defenders get him out of position … Despite possessing great size and length he is no better than average as a rebounder … Most of his rebounds come off of his own misses … On the defensive glass he doesn’t box out as much as he should, often leading to him losing rebounds to an opponent … Not an elite level athlete. His length and strength makes up for it but he doesn’t run fast or explode off the floor particularly well … Needs to work on finishing through contact … Has trouble scoring against longer defenders … Defenders that match his strength are able to keep him out of the paint … Improvement as a screener is necessary if he is to be successful at the next level … Should not be viewed as a rim protector … Lacks maturity and is prone to losing his cool as he did in the game against Wisconsin, slamming an opponents head against the floor, and drawing a one game suspension …",82,255,19.38
Stephen Zimmerman,41,"Possesses a very solid skill set and high basketball IQ that will allow him to eventually be impactful in the NBA … True 7-footer with 7’3” wingspan that can put it on the floor, block shots, and willing passer that looks to make plays for others … Has great touch around the basket with a decent hook shot with his left hand … Solid player in halfcourt situations. Very unselfish with high-level passing ability and decision-making … Great feel for the game with solid offensive skill set … Decent athlete that plays hard with high motor that can defend multiple pick-and-roll situations and has demonstrated the ability to recover in defensive situations … High energy player that can get up and down the floor and create open shots in transition … Mobile for a big man with ability to play the 4 and 5 positions … Can also play as a stretch 4 at next level due to above average mobility and good midrange shooting ability … Has the ability to put the ball on the floor and create shots and drive from the high to mid-post regions of the floor …","Needs to improve his post play for the next level on both ends … Given his size, needs to learn how to use his body better and improve his ability to create in the post … Decent leaper off two feet although can appear to be less explosive when having to explode from a standstill position near the rim … Has the tendency to play upright and doesn’t properly load hips to absorb contact, especially in deeper low-post situations … Forces him to play farther out at times and doesn’t establish solid position or seal off completely, also forcing him to get pushed out at times and settle for farther shots … Will need to add lower body strength to be more explosive and stay low … When catching ball in short corner situations, needs to do a better job of staying in a power stance with hips low in order to absorb and finish through contact while using his length … Didn’t show physicality and appeared to shy away from contact at times during low-post and rebounding situations … Needs to get physically stronger overall and fill out his frame in order to become a more effective defender in the post as well as a better rebounder, given his wingspan and length … Somewhat limited making plays with his right hand … Had an arm injury as a kid that never healed properly and makes it so that he cannot fully extend his right arm. There is speculation that he may never be able to full weight train, and therefore will lack strength …",83,235,19.8
Isaiah Whitehead,42,"NBA-ready body frame … Has the size and strength to play either guard position in the NBA at 6-foot-4, 210-pounds with a 6′ 8.75” wingspan … Finished in the top-10 in almost every category at the NBA combine’s athletic testing … Versatile combo-guard at the college level … Good court vision in the half court … Above-average/underrated passer and capable of creating for teammates … Showed solid instincts distributing the ball off the dribble and out of the pick-and-roll … Ball-handling skills have improved … Impressive scoring instincts … Has shown flashes of being able to operate out of pick-and-roll situations … Does a good job of utilizing screens … Shows a nice combination of quickness (has a quick first step) and body control when in attack mode … Attacking guard who has the ability to finish at the basket through contact … Is strong with the ball on straight line drives … When he does finish, he often does so creatively (knack for acrobatic finishes) … Has a knack for consistently drawing fouls and getting to the line…Can create for himself in space … Thrives in transition because of his aggression when attacking the basket … Capable of knocking down shots from beyond the arc (developing three-point shooter) … Has the ability to knock down quick pull-up jumpers off the dribble … Has a solid step back jumper … A tough defender with potential to good at the next level because he seems to possess good instincts on that end of the floor and has good athleticism … Plays defense with good intensity, a high motor, and great effort…Forces turnovers … Uses his solid physical frame to his advantage (played inside for short stretches) … Hard for players to get by him because of his build and quickness on the perimeter … Known as a player who does a little bit of everything for his team (scores, rebounds, steals, blocks, etc.) … Blocks more shots than most guards because of his height … Plays with a chip on his shoulder …","Can he continue to develop as a point guard? … Not overly explosive but he does possess some explosiveness … Struggles with his shot selection … Needs to take more efficient shots … Questionable decision-making leads to an overall lack of offensive efficiency … Seems to play at an extremely high level of intensity in spurts, but not sure he is able to sustain that over an 82 game season … Tries to drive to the rim when there’s too many defenders in the paint … Needs to work on shooting/shot making consistency, especially from the 2-point/mid-range … Mid-range game is a work in progress … Isn’t a good enough three-point shooter to rely on that part of his game … Settles for too many stepback jumpers at times … Has no rhythm on his spot-up/catch-and-shoot jumpers … Shot 38% from the field, including 36 percent from 3-point range last season … His shooting mechanics are inconsistent … Has trouble finishing in the paint and around the basket against length … His questionable decision-making affects him greatly when trying to score in traffic … He’s turnover prone because of his tendency to force bad passes….Often has tunnel vision … Defensively, he’ll need to improve on his lateral quickness … Has room for improvement in his defensive awareness and fundamentals … Lack of length is concerning on the defensive end at the next level … Will he be as versatile at the next level? His size may limit how much he can play at the shooting guard position … Sometimes plays out of control …",76,210,21.31
Zhou Qi,43,"Center prospect with great size, length and mobility … Elite help defender and rim protector with great timing, quick feet, mobility, and length … Covers a lot of ground defensively … Will contest shots not only at the rim but even close out and block jump shots … Very calm and smart player with good feel for the game … Rarely forces bad shots as he moves well without the ball finding open gaps … Soft touch around the rim and can finish with both hands … Can consistently hit a mid-range jumper and has developing 3-Point range … Above average and willing passer … Great ball handler for his size and can put the ball on the floor and get to the rim … Overall a two-way player that can contribute on many levels … Has shown improvement to his game since his rookie season in the CBA … Has gained weight during his time training in the USA preparing for draft workouts … All coaches have been said to enjoy working with him and that he shows the desire to get better … Lots of upside and a high ceiling if he can add weight … Has a good feel for the game in relation to most Chinese players …","Lacks overall strength and weight to be effective to hold his own at the next level … Defensive rebounding could be a big problem as he often just stands around and relies on his height and length not boxing out his man, and the jump from CBA to NBA in terms of strength is significant … As a one on one defender has trouble guarding bigger stronger opponents if they get into his body …  Has a tendency to struggle in big games … Lacks mental toughness … Not a leader, very quiet and not vocal on defense … Slow release and has little lift on his jump shot … Has shown talent, but hasn’t dominated the CBA like fellow countrymen Yao or Yi did before they left for the NBA … Listed age is a question mark like many CBA players.Summary: In terms of being an NBA player, Zhou Qi’s defensive abilities should carry over … He is currently not a scoring option on the Xinjiang Flying Tigers, and would also just be a finisher at the rim or spot up shooter in the NBA, but does have offensive skills … Right now obviously his limitations are physical as he will have a lot of trouble with stronger players, although he is not as soft as his thin frame suggests … Overall an interesting player with a lot of upside.",86,215,20.45
Isaia Cordinier,44,"Tremendous athlete with impressive quickness, athleticism and leaping abilities … He shows remarkable balance and body control, excelling in transition and in general in high pace game … He shows solid slashing abilities with effective change of speed and direction, thanks to his excellent footwork … Despite having rather developed scoring instincts he’s definitely not selfish, showing solid passing skills and court vision as well, especially when he creates space with his lighting first step … During these years he has shown also a solid off- the ball game, in P&R situations and with backdoor cuts … His shooting skills are improving, especially the three point shot jumped from 25% to 40% this season … His mechanics is still an ongoing project, but his release is quick and effective … Defensively he has solid lateral quickness and positioning, with a solid understanding of collective defence … He has the potential to become a really solid stealer, thanks to his timing and instincts. Smart kid perfectly integrated in the team and beloved by his teammates …","He has a narrow frame and shoulders, weighing only 190 lbs, simply not yet big enough to withstand contact at the NBA level … This is made worse considering his style is based on quickness and slashing abilities to get to the rim … Handle is still a major point of concern, limiting his ability to create off the dribble in ISO situations, when he only relies on his quickness and change of speed … Limited use of left hand … Defensive attitude is not consistent, he lacks necessary determination despite having solid fundamentals and potential … His shot is improving but mechanics needs to become more fluid and also the selection is quite poor … Played all his career in French second division, quite a low level … Over last couple of years he has been forced to the side-lines due to several injuries … Form on his shot not perfect, still in need of refinement …",77,180,19.58
Demetrius Jackson,45,Flashy point guard with explosiveness … Capable of impacting the game both as a scorer and a distributor … Feeds the post well … Solid creator out of the pick and roll … Excellent at penetrating and slithering through gaps in the defense … Deceptive with the ball in his hands … Doesn’t make many mistakes with the ball … Quality A/TO ratio displaying his efficency making decisions and valuing the ball … Plays in a pro style offense at Notre Dame … Despite a smaller stature he is a crafty finisher at the rim … He’s stronger than he looks and actively seeks out contact as he enters the paint … Good on ball defender … Can handle defending the pick and roll as well … Reads the player he’s guarding well … Has quick hands that help him pick the pockets of his opponents …,"At best he is only 6’1"", and even with a 6’4.75 wingspan (8 foot standing reach) is on the small side… Older for his age group (will be 22 in September) … Point guard skills and leadership need work … Not great at creating easy baskets for teammates …  Better on the break than in half court … Could stand to add a few more pounds to his frame (currently listed at 194 lbs) … Can he withstand the physicality of the NBA and still play the same type of game he does in college … Isn’t always locked in as a defender … Will lose focus when guarding off the ball … Tends to be caught ball watching when his man isn’t involved in the play … Too much of a streaky shooter on his jump shots … Struggled scoring this season when he became the focual point of the offense …His three point percentage has dropped from 42 percent as a junior to 34 percent this year, and FG from 50% to 44%, (though his 80% FT shooting is decent) … That significant statistical drop off is probably partially due to Jerian Grant leaving the team and teams focusing more of their defensive efforts on him … Needs to develop into a better overall passer … Has to show that he can handle going up against guards that are as quick as him and bigger as well … Production trailed off in second half of season, how much of that had to do with a hamstring injury is the question …",73,195,21.81
