Name,Pick,Strengths,Weaknesses,Height,Weight,Age
Mathias Lessort,50,"Mathias is an athletic PF with NBA body, with nice upside for the next level … Plays above the rim and does not shy away from the contact/will score under the pressure for plus one … Very effective in P&R situations, catching the ball early and attacking the rim with power … Sets hard and strong picks and reacts quickly … Explosive off the ground going off one or two feet … Catches lobs and alley-oops easy … Huge wingspan  (7’-foot) helps him to score over bigger opponents … Smart using his upper body around the rim … Does a great job at fighting for position on the low block and sealing his defender under the basket to catch the ball closer to the rim … Solid moves around the rim … Quick in transition; after the rebound he is quick to sprint and beat his defender for easy dunks or layup … Rebounds the ball strong and likes going after the ball … Possesses good timing for block shots (2.2 BPG) and it is very difficult to score over … Defensively he can guard multiple positions … On the defensive end he doesn’t have problems switching on P&R because he can move his feet quickly …","Slightly undersized for next level as a PF/C … Struggles with his shooting overall 59% FT … Lacks range. Mathias has to learn how to score outside low post and paint … He has to become a more effective shooter from mid-range/perimeter (15feet). Become a better ball handler … Not a smart defender … Can get in foul trouble quickly because he is not disciplined with his feet … Will try to block every shot … Can try to do too much at one time with the ball in his hands … Loses balance and shoots off balance on the low post at the time, has trouble with coordination … Not great with passing skills and court awareness on the floor …",81,235,21.75
Monte Morris,51,"The undisputed king of collegiate assist to turnover ratio enters the 2017 draft as an extremely experienced and high level floor general … Monte Morris’ ability to play big time minutes, and not turn the ball over is an obvious value at any level … His senior season in Ames he sported a 5.16 A/To ratio, his best at ISU … Morris’ offensive IQ is extremely high, and his ball handling, while not overtly flashy, is also well above average … He’s adept at using screens, penetrating the lane, and executing a fast break to perfection, which are translatable at any level … Monte is also a very good shooter … He’s never shot below .358% on 3s in college, and as a senior, he nailed .378% on 4.1 attempts per contest … He’s also a very good free throw shooter, and has a very good intuition in regards to shot selection … Morris can pull up off the dribble in the mid-range as well, and this again is utilized effectively due to his knowledge of spacing … Athletically, he’s quick and has good end to end speed with or without the ball in his hands … While lean, Morris stands 6’3’’ in shoes, and measures a solid 6’5’’ wingspan … He definitely possesses adequate size to guard the majority of NBA point guards … Monte’s defensive skills include quick hands, and good instinct in the passing lanes … Finishing at the rim was not a problem for him either at the college level … His 65% clip at the rim (according to hoop-math.com) is extremely good for a point guard … Plus, he has some room to fill out in terms of muscle mass … He used this length rather nicely on the glass where he pulled down 4.8 boards per contest, which is good for a point guard …","One pretty obvious weakness for Morris will be his slight 175 pound frame … For him to maximize his NBA potential he’ll need to fill out in order to compete with physical, strong NBA backcourts … He’s also a solid athlete, but at the next level, he’s going to give up athleticism on a nightly basis … He has the IQ to mitigate some of this, but it’s still a deficit … I feel Morris’ main issue in the NBA will be improving his scoring, and/or finding a niche in the NBA … It’s a luxury that he can be so efficient running an offense, but does not screwing up really warrant NBA minutes? Further honing his 3 point shot to become a 40+% shooter would also help his cause, this is very do-able because of his good mechanics … Since he most likely won’t be hanging his hat on the defensive end, he’ll need to up his game … He’ll turn 23 before his first NBA game, so he’ll need to figure out his NBA niche fairly quick or risk teams giving that roster spot to a guy they feel has a higher ceiling …",74,175,22.0
Edmond Sumner,52,"Lead guard with a very intriguing combination of size, speed and athleticism … Has a quick first step to get by opponents … 6’8 wingspan along with 6’5.5 height allows him to overmatch opposing point guards physically … Speed and quickness makes him highly effective in the open floor … Explosive athlete … Attacks the rim well off the bounce with his great first step and separation speed … Has good body control … Good finisher at the rim and created most of his own offense off the dribble … Can finish off drives with dramatic dunks … Nearly half of his FG attempts came at the rim … Does a good job of creating contact on drives and getting to the line (5 FT makes per game) …. Very good in transition and pushes the ball with the best of them … Unselfish passer. Team player … Can thread the needle with passes that somehow find teammates for easy looks … Adept at driving and kicking … Has improved in his ball handling and overall ability to run a team … Defensive ability has a chance to be elite, considering his physical attributes … On defense, his wingspan closes angles for passes and he does a good job of jumping passing lanes … Averaged nearly a block per game, proving to be difficult to get shots off on or pass over … Near 2:1 A/TO ratio at 5:2.8 illustrates his improvement as a decision maker … Played in 19 games as a sophomore, averaging 15 ppg on 48% shooting … Solid rebounder for a guard at 4.3 per game … Late bloomer who was beginning to have a breakout season before going down with injury … Despite outside shooting woes, has touch. 73% FT shooter, while not great, has shown steady improvement over college career … Goes left and right very well showing solid ambidextrous ability … Pick and Roll ability is a work in progress but showed steady improvement in sophomore season …  Efficiency in shooting continued to improve … Outside shot could potentially improve considerably at the next level if he gets with the right shooting coach … Coachable kid with a positive attitude … Despite being close to 22, his upside trumps a lot of other (younger) prospects in this year’s draft …  Shows a lot of potential as his skill set showed nice improvement this year and he has a great deal of physical talent to tap into …","An old sophomore who will turn 22 in December, diminishing the intrigue in his upside … Really struggles with confidence in his outside shooting … Jumpshot lacks great follow through as he sort of pushes the ball; lack of consistency on his form and release … 27% three point shooting (30% as a freshman) at his age is concerning … Feel for the game remains a work in progress … Still forces things too often off the dribble and doesn’t have a consistent enough shot for teams to play him to drive … Still learning the nuances of running the point guard position  … Not the most outgoing socially, so becoming more of a vocal leader at the point guard position will be important … Needs to develop more nastiness and physicality on the court … Body is very good but could use more muscle in order to play more physical and finish off drives to the rim, without being bumped off balance … While his upside is very good, he has to be considered a bit of a project … Should look to become better at shooting in spot up situations … Should look to further develop a floater which he showed at times, but will need to hone as getting clean looks at the rim at the NBA level is a much different animal … Will need to develop as an off guard, moving without the ball, posting up etc. in order to become more versatile and utilize his 2-guard size … Coming off an ACL injury adds some uncertainty about his future: Is he injury prone? Will he fully recover and how long before he can be expected to be at full strength? … Missed out on Xavier’s tourney run and experience remains a weakness as he played in the Big East, not one of the top conferences to test a PG … Underachieved slightly considering his talent level …",77,175,21.54
Kadeem Allen,53,"Allen has an impressive set of physical tools, listed at 6’3 with a filled out 200 pound frame and long arms to make up for his lack of height … He has excellent length for a guard and can definitely match up physically with NBA guards … Allen has demonstrated solid vision with the ball in his hands and has the potential to develop into a good facilitator in the half court … He can make accurate passes on the move with either hand and has done an exemplary job of running the offense for a young Arizona team … He still has room to grow as a distributor in the half court, but he has shown he can create for himself on offense as well … He excels at getting to the rim by utilizing his combination of quickness and strength … He prefers to get to the rim, but he has also improved as a shooter, particularly off the catch since last season … While he is still not a great shooter, he has become more than capable from outside, knocking down over 40% of his threes on the year (low volume: 30-of-72) … Where Allen is particularly appealing to NBA execs is his defensive potential … He boasts an excellent combination of physical tools at the guard position, and he employs his quickness and length well to pressure the ball outside the three-point line … He was one of the best defensive players in college basketball the last two seasons, showing the ability to guard several positions with his lateral quickness, wingspan and strength … Allen is a physical defender who is not afraid to get in his opponent’s chest and force a turnover, as he averaged 1.6 steals per contest this season … His lateral quickness and overall speed is elite … He also rebounds well for a guard, as he pulled down over four rebounds per game this season … Allen has the potential to defend NBA guards right now and his desire to accept that role as a defensive stopper along with his physical tools has placed him firmly on the NBA Draft radar … In addition, with his improvements offensively he could be a strong candidate to be a late steal in the draft …","Allen is a good passer in transition, but he has a tendency to put his head down in half court isolation situations, which limits his vision … He is also a bit turnover prone … He could stand to tighten up his dribble, particularly in traffic, which allows defenders to force turnovers … He needs to improve as a finisher in the paint, which is surprising given his physical tools … He also tries to avoid contact too often once he gets close to the rim which leaves him with some off-balance shots at the rim. On top of that, he doesn’t have great touch on his layups or floaters … While Allen’s shooting has improved, it is still not a great strength for him … He shoots a bit of a line drive, and he’ll need to improve his mechanics at the next level … His senior numbers from the floor were solid but on a low volume so there is some question about how well he can shoot at a higher volume … Already 24 years old, Allen will be one of the oldest players on the draft radar, there will be a lot of questions regarding his upside and if his offensive skills can be refined quickly enough …",74,190,24.45
Alec Peters,54,"4-man with a sweet shooting stroke and tremendous range … Experienced forward who was one of the most prolific scorers (23 ppg) in the country in his Senior year … One of the top overall shooters on the college level … A floor spacer who cannot be left open on the perimeter … With today’s NBA shifting over to specialty players, his one dimensional game could be enough to stick in the league … Knows how to operate on the block with solid post moves and rebounding ability … Very good feel for the game and can put the ball on the deck in transition or facing up in order to create shots … While slow, he does show some solid 3-man attributes with ball handling, passing and being able to face up and shoot … Helped by today’s NBA shifting to smaller 4s … Despite below average run/jump athleticism, at times he surprises with the occasional ally oop dunk or breakaway dunk in which he displays decent explosiveness, without contact … Hit 172 of 194 FTs in senior year, just a shade under 90%, illustrating what a phenomenal shooter he is … Seemed to put more attention into playing in the post in his senior year. Getting to the line almost 7 times per game … 10 boards per game shows his willingness to play physical and solid strength … Engaged defender who had effiecient numbers playing against bigs in the Horizon League …","Likely to be overwhelmed by NBA athletes. A below average athlete by NBA standards … At 6’8, moves like a center in a small forward’s body … Lack of size at the 4 position (6’8) compounds his athleticism concerns … Very slow laterally and slow to react to plays … He lacks the speed to defend SFs and ideal size and strength to defend in the post … Not especially fast in the open floor. A bit of a plodder. Coming off a season ending injury (stress fracture in his foot) puts draft chances in jeopardy … Level of competition was low playing in the Horizon League … Shot well below expectations as a senior at 36.3% 3p, after hitting 44.0% and 46.6% from 3 as a Junior and Sophomore … Drop in efficiency may be partially due to teams game planning to limit his looks from behind the arch …",80,235,22.21
Nigel Williams-Goss,55,"An extremely competitive and intelligent floor general … Consummate leader at the point guard position showing innate vocal leadership skills … Very tough minded and brings a high level of intensity every time out on the floor … Developed a reputation in high school AAU for never letting his teams lose, which has apparently carried over to college … Adept at facilitating the pick and roll … A very good playmaker for others, making those around him better … Plays very under control. A calming influence , attention to detail … A plus 2 to 1 A/TO ratio at 4.7 AST to 2.2 TO … Good ball handler, capable of dribbling in traffic, breaking the press, and able to scan the floor with his handle being second nature … Has an excellent jumpshot with very good form and shooting touch … Improved upon his shooting considerably in his year off, raising his FT% to 90% and his 3P% to 37%, (from 76% and 26% as a sophomore) hitting roughly 1/3 three point attempts every game … Improvement in his shooting is a testament to his work ethic and desire … Gets good elevation on his shot, has a quick release with good mechanics and follow through … Good at pulling up and utilizes the step back jumper well to create space off the dribble … Strong family background. Father is a strong positive influence on his basketball career … Has the make up to be a quality role player in the NBA a la Matthew Dellavadova … Bigtime rebounder at 6 per game …His good size at 6’3 will give him added ability to see the floor and pass over smaller NBA PGs … Solid length with a near 6’7 wingspan … NBA readiness very good after two seasons at Washington and a redshirt transfer year before his breakout Junior year …","Most of his weaknesses stem from his lack of run/jump athleticism … Below average athlete lacking great foot speed and overall quickness … Although his size helps to make up for it, his lack of speed probably keeps him from becoming a starter at the NBA level … Lateral speed will make it tough for him to contain NBA point guards … Figures to struggle to gain separation offensively … Struggles to finish on the break due to lack of explosiveness, although is crafty at using his body to shield defenders … Lack of quality competition in WCC through much of the season could be an obstacle … Already the age of a senior and while his maturity and readiness work in his favor, lack of upside at his age (will turn 23 in September) works against him … Not a speed merchant that pushes the tempo out in the open floor …",75,190,22.78
Jabari Bird,56,,,78,200,22.99
Aleksandar Vezenkov,57,"Vezenkov is typical European stretch PF that can play inside/outside with ability to knock down long-range shots from beyond the arch … Has good feel for the game and decent size for his position … Offensively he has ability to score from anywhere on the floor, but he is best at P&P situations and coming off of screens … Creates a lot of mismatches when playing P&R or P&P … Vezenkov has a very good jumpshot with a quick release and can get his shot off at any time … Possess deep range on his shot and fairly consistent. Likes coming off the flare screens and setting his both feet to square up for shot … Can make tough shoots under the pressure … Very smart when it comes to scoring in the paint, skilled and can play with his back to the basket; turnaround jump shots, spins around opponents, create space with one dribble and shooting the floater in the paint … He likes having the ball early on high post and posting up/taking his defenders on the low post and scoring … Uses lots of pump fakes to get open to create shots and scores … Does a good job at cutting into the lane quickly to the basket and finishing below the rim; can score under pressure well, and likes to take big shots … Improved his passing and he became better passer over the years … Rebounds the ball well and goes for rebounds aggressively … Hard working player … Comes from basketball family; his father played for Bulgarian national team … Has played at a high level in Europe for an umber of years now. Excellent experience … Skill set fits well in today’s NBA due to his potential as a high level shooter / stretch forward …","Limited ball skills offensively for NBA. Should look to improve as a ball handler, however his ability to create off the dribble is also limited by his lack of great speed … Doesn’t possess too much of an offensive game outside of his shooting ability … Solid athlete but has to improve his body and work on his physical toughness … Defensively, Vezenkov lacks speed and lateral quickness, and likely will be a defensive liability at the 3 or 4 spots … Offensively he has trouble scoring over bigger and stronger athletes … He is not quick or explosive enough to get by forwards in Europe and will struggle to do the same in the NBA … Will turn 22 in August, so his upside is not what some other prospects available",81,225,21.89
Ognjen Jaramaz,58,Jaramaz is talented European PG with size and speed … A good athlete who likes attacking the rim and tries to dunk the ball every time he has chance … He likes pushing the ball in transition and making good passes in the open court as well … Quick first step allows him to separate himself from defense and score … Most effective playing fast pace and running at full speed … If he attacks the defenders off the dribble he will most likely drive to his right and finish with right hand (feels most comfortable) …  Reads defenders well at P&R game situations and is smart enough to recognize when defenders are playing under to take 15-feet jump-shot that he feels comfortable and is very effective with … Good passer who will find open teammates for easy shots or layups. Improved his outside shooting and is not afraid to take deep shots under the pressure … Defensively does a good job at being active and staying in the passing lines/can pressure the ball on both G positions in defense … Handles the ball well and doesn’t turn it over (1.6 TO) … Rebounds the ball well for his size and does a great job at following missed shots; scores numerous times on put-backs dunks and easy layups under the rim when no one is expecting … Hard worker on the court and great kid off the floor.,Jaramaz has to improve his outside shooting in order to be more effective player at the next level (this season he is shooting only 28.4% for 3) … Must become a better decision maker on P&R situations … His jump shot has low point of release and has to learn how to shoots it higher among other things in that area; in my opinion he has to change his shooting form in order to increase his outside percentage … Defensively he is trying to go for too much at the times … His age works against him some as he’s already draft eligible and older than other options at the PG position …,76,195,21.82
Jaron Blossomgame,59,"Has NBA athleticism with a strong, muscular frame and explosive leaping ability …  Defense is the greatest strength to his game … An excellent defender with shut down potential … Possesses good size at the wing position with a 6-foot-8 frame and solid length … 4 years of college experience … A mature, focused player who competes hard … Uses his strength well to muscle opponents and create scoring opportunities … Explosive athlete capable of highlight finishes over defenders … Aggressive offensive rebounder … Hits the boards hard and scores a lot of garbage buckets through desire … Very good in the open floor as he utilizes his above average athleticism and body control well on the break … Shot 45% from 3 as a junior (on over 3 attempts per game), but really struggled to get on track in Senior year shooting just over 25% … Free throw shooting and overall shooting showed steady and significant improvement up until senior year …","Lacks a great offensive repertoire … Struggles to create offense in the half court … Not a very good ISO player as he lacks great ball handling and ability to pull up off the dribble … Not much of a playmaker for others as he lacks vision and passing skills … Jump shooting remains a real weakness to his game … His inability to make outside shots consistently allows opponents to sag off him and play him for the drive, making it difficult for him to get by defenders … Mechanics on his jumpshot are not fluid and lack consistency … His shot lacks great arch, the release point is too low and he doesn’t get enough elevation … His shooting form breaks down against quality defenders or when he attempts shots out beyond 3 point range … After a very strong junior year shooting from behind the arch, he has struggled mightily as a Senior … After a redshirt year, lack of upside at 22 years of age decreases his appeal …",79,220,23.79
