Name,Pick,Strengths,Weaknesses,Height,Weight,Age
Justin Jackson,15,"Playing for a team like UNC, Jackson will come into the league having a ton of big game experience on his resume…In addition, he’s proven himself to be a big time player on the big stage and high-pressure situations … A solid and fluid athlete with an all-around skill set … Smart player and has good intangibles …Versatile scoring ability … Capable of scoring in bunches … His 6-foot-8, 201-pound size should allow him to play out on the wing, as stretch-four, or down low at times at the next level … 6-foot-11 wingspan gives him great length…Has made major strides in his shooting … His improved mechanics have helped him release the ball much cleaner and faster … Is much more confident as a shooter … Can shoot the ball with range … Jackson has become a more efficient shooter from various spots on the floor, thanks to his improved mechanics …Can knock down mid-range jumpers consistently … Timely three-point shooter…Acts as a spot-up weak-side threat and can even shoot coming off pindown screens … Comfortable sprinting into catch and shoot threes turning left or right … Does a great job of relocating for quick handoff after giving up the ball … Makes the right reads on and off the ball to help him score … Adequate scorer off the dribble coming off curls or on straight line drives…When he gets to the basket, he likes to score off floaters or pull-up jumpers … Has shown that he can be a crafty finisher when he does get all the way to the basket … Can score on the move, as he frequently creates scoring opportunities for himself by way of off-ball movements … Can bend the defense with his off-ball cuts and shiftiness off screens … Has the ability to read screens in set plays or finding open spaces in a more free flowing offense … Jackson is a good playmaker for his teammates … He’s a willing and capable ball-mover … He sees the floor well and is capable of delivering accurate and tough passes to set up his teammates … Has a good feel for the game … Defensively, he excels on that end of the court … A good communicator on this end of the floor … His size and athletic tools give him the ability to be terrific position defender, as well as guard multiple positions … He’s not a player who’ll end up with high steal and block averages, but he’s good for coming up with timely steals and blocks at key points in a game … He can get by screens and keep up with smaller wings on the perimeter or hold his own against bigger post players in the paint …","Not the most athletic wing that’ll come out of this draft … Does not have elite explosiveness … Has a thin and lanky body frame, which could limit him on both ends … May struggle with the physicality of the NBA early on in his career … Adding strength will help him reach his ceiling as a small forward or small-ball 4-man, especially defensively when guarding the likes of LeBron James and Kawhi Leonard in the NBA … He’ll need to show that he able to get to the basket and score against bigger defenders … On defense, there are questions about whether or not he’ll be able to prevent stronger and thicker opponents from bullying him in the paint … Doesn’t project to be a lockdown defender at this point in time … His lateral quickness and physical build didn’t always seem to hold up when guarding NBA-level wing players …When he’s hot, he’s hot, but otherwise, he’s a streaky shooter (still not an elite shooter) … Can sometimes be careless with the ball, leading to turnovers … Struggles creating offense off the dribble out of pick and roll and isolation situations … Lacks an elite first step when trying to get into space and struggles to handle the ball in traffic … He’s not able to shake his defender off the dribble on a consistent basis … Many of his drives are cut off by defenders before he can get into the lane … He can get stuck dribbling from sideline to sideline instead of toward the rim … When he does get into the paint, he’ll rather shoot a floater than attempt to take contact at the rim … May have trouble finishing around the basketball against longer defenders due to lack of strength and explosiveness … Does not attempt many free throws (just 4.2 attempts per 40 minutes) … Can be a better rebounder for his size and athletic ability … Averaged just 4.0 defensive rebounds per 40 minutes … Doesn’t seem confident enough to throw his weight around in traffic to fight for loose balls …",80,200,22.25
Justin Patton,16,"A legit seven-footer … Has good agility and lateral quickness … Plus athlete for a player his size … Explosive off of the ground … Quick leaper, second jump was faster than others’ first in college … Can be a distraction at and around the rim defensively … Played well vertically in the interior … Also will be able to pluck away steals occasionally … Can switch out and defend guards on the perimeter … Doesn’t get out of his stance when faced against a guard and relies on his length and agility to smother smaller players … Best suited as a dive big man in a pick-and-roll heavy offense … Developed rapidly from a no-name recruit to up-and-coming college star … Shown a comfort shooting on the perimeter, yet isn’t likely to develop that part of his game … Needs to time to set his feet when shooting from outside … Much more comfortable taking outside shots in catch-and-shoot situations … Still raw, but has a refined set of moves when playing out of the post … Very effective finisher at the hoop on offense … Converts a lot of paint touches into points via above the rim play … Great in transition will run straight to the paint and then seal off his defender under the rim … Possesses the grace of a gazelle when he runs … Will beat most big men down the court in transition …  Good hands, can catch tough passes or convert inaccurate passes into points … Has nimble feet … Late growth spurt means he has some guard abilities in his game … Comfortable starting a break or making a few ball handling moves on the go with the ball … Has tons of potential and upside …","Redshirt freshmen, will be 20 years old by the draft … Will need time to develop … Could end up spending the better portion of his rookie year in the D-League, rather than in the NBA … Very raw and needs to continue to build on the foundation of his game that he has … Has gotten stronger during his time at Creighton, but is still skinny for a big man, and may always be a bit on the thin side … Must show that he has the strength to bang and hold his own with NBA big men … Can get a bit dribble happy at times and will turn the ball over against pressure in the backcourt … Needs to fine tune a specific post move, often overthinks when on the block which leads to turnovers or missed shots … Rebounding and overall aggressiveness should improve with strength … 6.2 rebounds per game and 9.8 per 40 minutes, while decent, should be higher for a 7-foot center with his athleticism playing in the Big East … Added strength should allow him to get to the free throw line more as well. 2.5 trips to the line per game illustrate his lack of physicality … Shot just 51% from the free throw line. Will need to improve upon that as it’s far too low for a player with his shooting stroke …",83,230,20.04
DJ Wilson,17,"Wilson was a late bloomer this season for Michigan, and he particularly broke out in the NCAA Tournament demonstrating numerous abilities that offer intriguing under the radar NBA potential … He was a key player in turning Michigan’s season around on their way to the Big Ten tournament title and a trip all the way to the Sweet 16 in March, after an up and down regular season … After averaging just 11 points per game in the regular season, he exploded in the tournament, averaging 18.5 points per contest and 3.5 blocks in three games, showing his ability to perform in big moments … At 6’10” and 240 pounds, he is quite a fluid mover and runs the floor very well in transition with long strides … He is also a good cutter without the ball, allowing him to get loose and get easy baskets at the rim … Wilson has good length with a 7’3” wingspan and can finish above the rim in space when receiving passes off of cuts or in transition … Wilson also demonstrates some good perimeter skills for his size, offering potential as a stretch four man in the NBA, which is essential nowadays for modern NBA big men … He has shown to be a dangerous pick and pop threat (37% 3s) and has good mechanics with a quick release and high release point … The defense has to respect his ability to catch and shoot, and he does a good job of attacking closeouts with his footwork and solid ball handling ability to counter when the defense prevents him from catching and shooting … Wilson is a good straight-line driver with both hands, but he likes to drive to his left so he can get to his floater with his right hand … He has good touch on his floater and is able to get his shot off over a lot of defenders with his size and length … Wilson has also shown a respectable face up post game and has an excellent face up jumper off of his inside pivot … He also has excellent footwork in the post and the ability to make jump hooks with either hand … On the defensive end, Wilson is rangy on the perimeter with the ability to keep smaller players in front off the dribble while still being able to contest jumpers with his length. He also has good closing speed on the perimeter and can chase guards off the perimeter due to his fluidity … He also has good lateral quickness and can switch/hedge out on ball screens and still recover … He also offers upside as a rim protector with his length and solid timing once he can refine his defensive awareness … He can also use his length to get in passing lanes and force turnovers off the ball.","Wilson has some outstanding physical tools, but he still needs to learn how to maximize them with consistency … Often times instead of getting all the way to the rim and finishing with his length, he will settle for contested jumpers even when switched on a smaller player … He has a tendency to float on the perimeter when matched up with smaller players instead of posting up and using his size … He has great skill, but he will settle for a lot of contested jumpers early on in the shot clock … Wilson does not have great vision and can improve as a passer out of the post … He has a good handle for his size but will try to do too much at times and over dribble instead of relying on primary ball handlers, which leads to avoidable turnovers … Wilson needs to improve his physicality and toughness in the post, as he does not work hard to get good position against players his size … He also is not a great finisher in traffic and does not get to the free throw line that often (2.3 FTA per 40). He is skilled but he shies away from contact and mostly relies on finesse rather than physicality. He has great upside on the defensive end, but he needs to improve his awareness before he reaches that level … He can be late to hedge out on ball screens and often gets beat off the ball on cuts … He can do a better job of staying low and being in a good stance to maximize his explosiveness … He also does not always see the ball well, which makes him late to come over to the ball side and help out when needed, and he does not always jump to the ball from the weak side … The biggest thing he could improve upon, however, is his production on the glass … In 30 minutes of action last season, he averaged only 5.3 rebounds per game … With his combination of size, length, and athleticism, that number should be much higher … Improving his toughness and learning how to get good position down low will allow him to be much more of a factor here …",82,235,21.35
TJ Leaf,18,"A versatile offensive player who shows the ability to play both inside and out … He has a European-like skillset and does a great job of exploiting mismatches on offense … Although he is not an advanced post player at this stage in his career, he has shown flashes of good footwork and a variety of post moves from the block … He has nice touch around the basket and effectively utilizes jump hooks, turnaround jumpers, and even an occasional dream shake … As a shooter, Leaf has good mechanics and is more than capable stretching the floor as a three-point shooter … He also demonstrates a solid mid-range pull up game, particularly from the elbows … He excels at taking bigger defenders off the dribble and does a great job of utilizing ball fakes from the perimeter … Leaf is not an elite athlete, but he is a good jumper off two feet and can finish above the rim consistently … Even though he isn’t the quickest laterally, he does a good job of moving his feet and using his size to stay in front of quicker guards … He also has solid defensive instincts and is a capable shot blocker … Two of Leaf’s strongest attributes are his high basketball I.Q. and his motor … He has also proven to be a clutch player who doesn’t get phased by a big moment or crowd (Rupp Arena) … Leaf moves well without the ball allowing him to get high quality shots … He’s also an excellent and willing passer for his size … Rarely does he force the issue, and he is almost always under control … He plays with consistent effort and regularly makes hustle plays, particularly on the offensive glass … Leaf is a terrific rebounder, which has a lot to do with how relentlessly he pursues the ball on both ends of the court … Leaf’s size, versatility, feel for the game, and motor make him a prospect with a high floor …","The biggest area of concern for Leaf at this point is his lack of strength … He needs to add leg and core strength to better absorb contact and maintain balance … The good news is that he is only 19 years old and that there’s plenty of time for his frame to fill out … However, this hurts his ability to defend in the post where he can sometimes get pushed around … Although he is a capable finisher at the rim, he also struggles to finish through contact and does not have great body control when attacking the basket … As skilled as he is, rarely does he finish around the basket with his left hand … Leaf will need to improve in this area at the next level, or it will be much more difficult for him to score consistently … Right now he projects as more of a stretch four than a reliable go to option on the block … Leaf also doesn’t have great length and doesn’t really project as a rim protector at the next level … Although he has good instincts, he struggles defensively at times with longer and more athletic forwards …",82,225,20.16
John Collins,19,"6’10” interior presence that is very active for a big man … Has the length and skill to be highly effective around the basket … Plays with good energy, effort and consistency … Doesn’t shy away from opponents, can play through contact at the rim … Rebounds at a very high level … Attacks the ball when it is in the air … Very quick second jumper. Explosive leaper … Keeps plays alive with effort on the offensive glass … Positions himself well, always around the ball when it comes off the rim … Uses body to get to the places he wants on the floor … Good enough footwork to do some damage in the post, especially against smaller players … Scores easily down low (62.1 FG% on the year to date) … Great in transition, constantly beating opposing players up and down the floor … Has a smooth stroke and has the ability to knock down jumpers in the mid-range … Not much of a perimeter threat, but can put the ball on the floor for a few dribbles effectively … Has very soft hands and makes contested catches … Works well as a lob man out of the pick-and-roll … Wingspan and frame allow him to finish at a high-rate around the basket … Slams home anything that comes within his catch radius … Mobile enough for a big man (if strength comes will see most time as a center at next level) … Defensively, is able to block shots due to his size and long arms … Excellent feel and timing as a help defender … Quick to recover and rotate on defense … Has improved every year at Wake Forest … Has received great coaching from Hall of Famer Danny Manning … Hard worker that leaves his all on the court … Appears to have a strong body frame to add weight and maintain a high level of mobility and athleticism …","Aside from interior scoring and rebounds, doesn’t contribute much offensively … No outside game at all, has attempted just one three-pointer in two seasons at Wake Forest. Has shown some semblence of a face up game but needs to add range and consistency … Gets blocks but is also very foul prone … Often leaves his feet when he doesn’t need too …  Plays defense standing too tall … Allows players to beat him off the dribble too often … Lazy in his pick-and-roll defense … Will hedge too high and leave his man wide open on the roll … Defensive awareness is lacking … Needs a crash course in the fundamentals of defense … With his form you would expect him to be better from the free throw line (currently at 73 % on the season) … Not the most fluid player running the floor, has a short stride … Foot work in the post needs work … Needs to become a better passer as well … Too often allows the defense to load up on him before trying to attack the basket or swing the ball to the open man … Could stand to fill out his frame more if he remains an inside-only type of prospect …",81,225,19.76
Harry Giles,20,"Giles is an extremely gifted athlete, arguably the best big man prospect in this entire draft when healthy, something he hasn’t been in quite a while … Looks the part of an NBA big man with his frame … An explosive leaper even with the injuries to his knees …  He’s got great hands which allows him to finish around the rim and in traffic …  He runs the floor well for a big man and is active on the glass … Shows a lot of physicality in the post and doesn’t shy away from contact on defense … Takes contact in the chest, isn’t easily moved off of his spots and is an above average rim protector … Moves his feet extremely well and has really good lateral quickness for a big man … Can play both the PF and C positions in the NBA from a defensive standpoint and while he is a work in progress on the offensive end, he has exhibited an ability to use a variety of post moves to score in the paint … Before his injury, he excelled in a face up game from about 15 feet and used his superior quickness, length and athleticism to get to the rim and finish with a purpose … The consensus top overall player in his class for years while in high , Giles has everything an NBA scout/GM could want from a prospect physically … A tremendous kid with a extremely outgoing and likable personality …","Multiple knee surgeries including two ACL tears (both knees) and an MCL tear (left) before graduating high school is a huge question mark with regards to the outlook of Giles’ career.  No team wants to draft the next Greg Oden and players with injury histories like that of Giles always raise red flags to scouts and GM’s who are putting their jobs on the line with every draft pick and free agent signing …  His ability to explode with contact seemed affected … As far as Giles’ looks on the court, he seemed to get lost at times during his freshman season and was almost afraid to do certain things … Whether that was simply due to a fear of another injury, lack of conditioning, Duke’s struggles in developing bigs, or an awareness thing remains to be seen … He isn’t a versatile player on offense and doesn’t really possess the range that you would like to see out of a PF even though that was always was he projected to be during his days in high school …  Doesn’t have great footwork or great touch on offense and relies heavily on put backs and dunks for most of his points …  His jumper is one glaring hole in his game as he routinely air balled or barely drew iron once outside of about 12 feet …  Doesn’t make great decisions on offense and hasn’t really learned to simply play within himself just yet …",82,230,19.18
