Name,Pick,Strengths,Weaknesses,Height,Weight,Age
Markelle Fultz,1,"Fultz has elite physical tools for an NBA point guard at 6’5” with a 6’10” wingspan … He has big, strong hands, excellent feet, a solid frame, terrific body control, and he absorbs contact very well … He is very imaginite, shifty with the ball in his hands, can finish above the rim with regularity, and is an explosive leaper off of one foot or two feet when he has momentum … Fultz has great extension and finishing ability at the rim due to his length and large hands; his size and length allows him to get off his pull-up jumper and elevate over the top of other guards; also at times will utilize his size advantage in the post against smaller defenders where he can shoot over the top of them … He is a strong, physical player who does not shy away from contact, and he does a great job of going into the chest of the defender and maintaining control in the air so he can finish acrobatically … He uses his size to get to good scoring angles at the rim; his length also allows him to finish at the rim and make it difficult for defenders to contest his shot … Fultz has a very smooth all around offensive game with tremendous scoring instincts and the ability to put the ball in the basket from all three levels consistently … He has the makings of an elite go-to scorer, which is so valuable and rare at the next level … He can be effective playing both on and off the ball as a playmaker or scorer; an outstanding pick and roll player, excellent creativity and decisiveness as a ball handler … He does a great job of changing speeds and getting to his spots on the floor … In transition he pushes the ball up the court, gets downhill, and uses his elite body control to finish at the rim off the break … Fultz’s knowledge of how to use change of speed and directions is unusually advanced for someone his age, a skill that will translate to immediate success at the next level … Off the pick and roll, he does an excellent job reading his defender and has the ability to pull up all the way from three-point range if the guard goes under the screen or if the big man does not come up to help … He also has an excellent hesitation move that freezes the big man when he does come up to help; he has a deadly pull-up jumper off of the hesitation move, similar to the way Kevin Durant used this move so effectively at Texas … Fultz has an assortment of quick dribble moves from stepbacks, crossovers, spin moves, etc. if the guard gets through the screen … He’s also comfortable using his size, particularly when getting into his mid-range pull up; covers ground very well, uses long strides and consistently gets to the rim in one dribble when penetrating off the pick and roll … He has unique change of direction ability as well, which he uses in the paint to get by bigger defenders … He is a talented isolation scorer who uses hang dribbles and hesitations effectively; can make tough shots off the dribble; able to rise into jump shots off a one-two step and is comfortable making contested jumpers … His respectable pull-up game allows him to get to the rim much more easily when in isolation situations … He does a great job utilizing hesitation crosses to get in the lane and score; also does an exemplary job of being deceptive and unpredictable off the dribble … It is difficult to defend him because of his wide variety of dribble moves … He is not an elite catch and shoot player but more than capable of knocking spot up shots down from the perimeter … He has smooth mechanics with NBA range; also does a good job of knocking down shots when coming off screens where he has excellent balance and shot preparation … He’s very good at attacking closeouts as well, to pull up or finish at the rim … His great instincts are particularly shown in these situations; crafty finisher at the rim, has soft touch on two foot floaters with good balance; can stretch in the air around long defenders with his length; great finisher with his left hand where he gets excellent extension … Fultz is a creative, willing passer with an outstanding feel for the game; has a higher assist percentage and lower turnover percentage than Lonzo Ball … He will be a dangerous playmaker with NBA spacing and better shooters around him … He is dynamic in the open court and can make passes from numerous angels in transition … He does a great job of keeping his head up and finding big men running the floor or shooters on the wings in transition … He is also a terrific passer off the pick and roll, where he uses creative wrap around passes; will split the defenders off of ball screens and find big men in the short corners for easy conversions … Fultz is very patient off the pick and roll and does not force the issue often;will wait for the play to develop before making passes. He does a good job of using both sides of the floor and can make passes over the top due to size and length. Fultz must improve his focus and intensity, but he has the tools to develop into a lockdown defender at either guard spot; uses his body well to stay in front and has quickness to run stride for stride with smaller guards. His 6’10” wingspan makes him tough to shoot over; does a good job of being physical with bigger guards inside and can make things tough for big guys down low off of switches. He can cover a lot of ground, as shown by several chase down blocks this past season at Washington; also shows good instincts off the ball and has good timing on rotations from the weak side in the half court; a very low risk, high reward player; one of the most complete college guards in the last decade.","Fultz is a very hard worker off the court who has shown dramatic improvement each year since his days in high school, but he can play with more consistent intensity in games … The game comes too easily for him, and he can take plays off particularly on the defensive end … He can be loose with the ball at times on offense … Especially turnover prone on his spin dribble … While fairly quick with his feet and creates extremely well with decption and hesitation, he’s not the fastest player running in the open floor … Fultz played on a bad Washington team but some question whether he can lead a team the way a star should at the next level given the low number of wins this past season … On defense he can be a little too upright at times, which causes him to struggle containing the dribble; his closeouts on perimeter can be lazy and out of control … He does not always fight through screens, allowing shooters to get open looks or quick guards to turn the corner; will lose focus of his man often when off the ball, frequently beat on backdoor cuts … Fultz is not overly turnover prone, but he can telegraph passes at times and be a bit lazy in this area, leading to avoidable turnovers … His shot selection is poor at times, but this may have been the result of having to carry the team at Washington … He will settle for a lot of tough mid range jump shots; has greatly improved shooting but still a bit streaky, more of a tough shot maker than pure shooter at this stage … He has a tendency to shoot on the way down on pull-up jumpers … He misses short a lot and needs to put more of an emphasis on getting legs into his shot … Fultz does not have the quickest first step and struggles to turn the corner against more athletic defenders … Will have to rely more on craftiness and deception to become an elite scorer in the NBA …",76,190,19.08
Lonzo Ball,2,"At 6’6"" with a 6’9"" wingspan, Ball has a unique set of physical tools for a point guard that will provide him with a number of advantages in the pros … One of the first things that stands out about Ball is his elite transition play … It starts with his ability to force turnovers and haul in defensive boards to push the ball up the floor and begin the break … He also has tremendous speed in the open floor when the ball is in his hands, but the skill that truly transcends above all other players his age is his elite vision, creativity and passing ability … Not only does he demonstrate the ability to deliver exceptionally accurate passes, but his knowledge of when to push the ball up the floor himself and when to give it up to his teammates is impeccable … He always knows where his teammates are on the floor and gets them the ball in spots they are comfortable … In a basketball sense he’s playing chess, while his peers are playing checkers … Ball constantly moves the ball, makes quick decisions, and has extremely rare vision for a player his age … He has excellent ball-handling ability, but does an exemplary job of not over dribbling and keeping everyone involved … He is also very efficient in transition where he posted an outstanding 4.1-to-1 assist to turnover ratio … The half court is where Ball is a more polarizing player, with transparent strengths and weaknesses to his game … His greatest strength in the half court is still his court vision and creativity prowess … At 6’6” he has the size to see over the defense and find shooters on the perimeter or make entry passes to the post … He also has the basketball IQ to see plays before they happen, which is not something you see often from a such a young point guard … More impressively, his willingness to move the ball was contagious, as UCLA’s offense featured constant fluidity and unselfishness from everyone on the floor … Ball might have the most unorthodox shooting mechanics you will ever see, but he is still a tremendous shooter, particularly off the catch and from long range … Ball connected on 41.2% of his 194 three-point attempts this past season, many of them from far beyond NBA range … Despite his odd shooting motion, he releases the ball squared to the basket and gets great rotation on his ball … In addition, Ball is an above average shooter on the move, as he does a good job getting his feet underneath him when coming off of a screen … He also has a lethal step-back jumper, which is one of his go-to scoring options in isolation situations or off the pick and roll … The combination of his deep range and comfort with the step-back can be a tough guard for opposing defenses … One, perhaps unexpected, area where Ball contributes offensively is cutting off the ball, resulting in easy conversions off of lob passes to the rim … In his one season at UCLA, he proved to be a much better athlete than most thought coming out of high school … Ball understands the use of deception and has a real knack for lulling his defender to sleep off the ball, then using hard backdoor cuts to create scoring opportunities … Ball will fit well in the modern up-tempo NBA game today …","Ball has an outstanding combination of size, length, and athleticism, but his frame is not filled out yet, and he can struggle with more physical guards at times … This also hinders his ability to consistently get into the paint off the dribble … Wears a leg sleave and his legs appear to be underdeveloped … He has terrific speed but does not possess the quickest first step, which will make it more challenging to put pressure on the defense in the NBA … The biggest knock on Ball at this stage is his inability to consistently create his own offense when things break down … Ball is not great in isolation and generally his pick and roll possessions end up as a passer … He very infrequently used the pick to get into the paint and find his own offense … He also rarely showed signs of any mid-range game or the ability to pull up off the dribble … Ball will likely need to play alongside several other offensive threats to be able to generate his own offense in spurts … Where his awkward shooting mechanics can be exploited is off the dribble … On the one hand, Ball converted on 48.6% of his jumpers off the dribble, a number that was near the top in college basketball … However, rarely did he attempt such shots this season, and most of them were step-back three pointers rather than mid range pull ups … His inability to pull up in the mid-range is a function of his extremely slow shooting mechanics. Ball’s low release point and need to come back across his body certainly seem to factor into his inability to get his jumper off when pulling up off the dribble, and he has almost no in-between game because of it … He will need to develop a somewhat quicker release if he ever wants to be effective in this facet of the game … A lot of Ball’s baskets in the half-court at the rim were assisted, which indicates his ability to move off the ball along with his struggles creating his own shot off the dribble … On the defensive side of the court, Ball is adept at forcing turnovers, but he does not have the overall impact that his physical tools would suggest … Ball struggles at times containing dribble penetration against quicker guards, which was particularly exposed against De’Aaron Fox, who exploded for 39 points against him in the NCAA Tournament … Ball also does not have great awareness when being screened, and he also could show more consistent effort to fight through screens and recover … Ball is an intriguing prospect, but his weaknesses are well documented, and he will need to be surrounded by the right personnel to achieve optimal success … Perhaps the biggest question mark surrounding Ball has nothing to do with his game whatsoever … Some NBA execs view his father, LaVar as a potential problem with his ""over involvement"" and the endless controversial comments he has made over the last few months … The hope is that he will fade into the background and not be too involved with Lonzo’s day to day decision making, and ultimately career. Time will tell …",78,190,19.67
Jayson Tatum,3,"Tatum lived up to lofty expectations placed upon him in his freshman season at Duke, as a result of being heralded as a top-five high-school recruit by virtually every recruiting database … Despite the fact that he missed the first eight games of the season with a foot injury, Tatum developed into an absolute superstar by the end of the season for the Blue Devils, averaging 16.8 points, 7.3 boards, and 2.3 assists per game … Tatum’s NBA potential begins with his prototypical physical profile for a wing player … Standing at 6-8, with a 6-11 wingspan, he has an excellent frame that appears will fill out over time with broad shoulders and great hip mobility for his size … Tatum is a fluid athlete with long strides in the open court and the ability to cover a lot of ground … Another great tool Tatum offers is his ability to play small ball four man in short stretches like he did frequently at Duke. His uncommon skillset is visible right away in his ability to corral defensive rebounds and push the ball up the court effortlessly in transition … He is also great on the fast break off the ball, as he understands how to fill lanes correctly and get himself an easy finish at the rim … His impressively long strides also come to play in the half court, where he can catch from the arc and get all the way to the tin in one dribble … He has great extension when finishing at the rim, and his long wingspan allows him to finish above the rim in space … Tatum’s most intriguing selling point, however, is his highly advanced offensive skillset in the half court, and his NBA ready scoring ability … He is an exceptionally polished scorer for a 19 year old, having the ability to operate from all three levels. He is at his best in the mid-range area where he can create space and shoot over the top of the defense with a high release point on his jumper … He also has outstanding footwork and is never too sped up by the defense … Tatum excels out of the mid-post area as well where he has a variety of moves in his arsenal to beat his man … One of his weaknesses coming out of high school was his below average spot-up shooting from three-point territory … Tatum has improved in this area, as he is most certainly a capable threat from deep, especially off the drive and kick … He has also always been a terrific free-throw shooter (84.9% this season), which provides plenty of promise for further improvement down the road … He is also a good pick and pop threat when needed to play the four … He is particularly strong with his one dribble pull-up jumper going to his left, and he just does a great overall job of attacking hard closeouts with superb footwork … Tatum is probably the best isolation scorer in the draft as well … He utilizes a variety of hesitation pull-ups, jab steps, step backs, crossovers, spins, etc., and he can stop on a dime with ease to get into his shot … He was an absolute nightmare four opposing four men to guard, especially in the mid range, where he used his shiftiness and creativity to get into his mid-range game at will … He also is great at changing speeds in isolation situations to keep his defender off balance and get to the rim … Tatum is a handful to guard when facing up in the post … Defenders have to respect his ability to rise into his jump shot, but he counters this well with an explosive first step off the dribble going to his right … He also employs an occasional Dirk-like fall away jumper that is nearly impossible to guard, and he is great overall feel for where the defender is when posting up … He is still improving as a playmaker, but he has good vision in transition and can see over the top of the defense off the pick and roll … Tatum also has the tools to hold his own on the defensive end in the NBA as well in large part due to his size and length … He slides his feet very well when locked in and uses his length to his advantage (1.4 blocks and 1.6 steals per 40 minutes) … He can cover a lot of ground when closing out on shooters, as he would often run all the way from the ball side of the court and force a difficult shot when the ball was skipped over to his man … He also has the agility to contain quick perimeter players off the dribble and the length to consistently force contested shots … He shows flashes of great instincts and can cover a lot of ground rotating from the weak side to protect the rim … Tatum has good hands off the ball and anticipates passing lanes well … He proved to be a factor on the defensive glass, posting a clip 7.2 d-boards per 40 minutes … His professional approach to the game and work ethic are also noteworthy … He consistently demonstrated the ability to stay calm in pressure situations and come up big in crunch time … His game will fit well in the NBA, and he should be an immediate impact scorer … He is one of the more unique players in this draft and can be considered a low-risk, high-reward player …","One of the first flaws that jump out in Tatum’s game is his inconsistent intensity on defense … At times, he seems to just go through the motions defensively and didn’t demonstrate the competitive desire to lock his man down … In addition, he is an excellent small-ball four on offense, but the same cannot be said about his defensive impact from this position … He is not physical enough to handle bigger players down low, and he needs to add some strength to his lower half … His technique on the perimeter can improve, as his closeouts can be quite lazy, allowing for his man to get by him with little resistance … He is also not the most physical perimeter defender and can do a better job of getting in his stance and containing the dribble … In transition, he does not always sprint back to the paint to help out against penetrating guards in the open court … In an NBA game nowadays that is heavily predicated on up-tempo offense with an abundance of quick guards who love to get in the lane on the break, this is something that he must address … One of the other question marks is that he is still a streaky spot-up shooter … He shot 34.3% from the arc at Duke this past season, which is not bad, but it is not good enough to classify him as an elite knockdown shooter … He is much better as a mid-range shooter and there are questions about if he will be able to adapt to the expanded three-point line in the NBA … Off the catch, his mechanics do not look quite as fluid when he is contested, and he is not always balanced on his release, which can also be a bit quicker … He also must become a more reliable scoring threat off the pick and roll … In these situations, defenders would mostly go under the ball screen, and he frequently would not make them pay with his pull up when this happened … Tatum also was guarded mostly by power forwards, so there are concerns about whether he will be able to create offense as effectively against NBA caliber wing players … His handle can be tightened, as he plays a bit too upright with the ball, making him less explosive … He does not have great burst from a stand still position, which causes him to struggle getting to the rim, and he has trouble finishing against top tier length and athleticism … This forces him to heavily rely on tough floaters and two-point jumpers, which is an inefficient way to score … Tatum can further refine his decision making on offense, as he can be too dependent on isolation offense, even if he excels in these situations … He is not the most comfortable playmaker on the move, and because of his inconsistent spot-up shooting in addition to that; there are questions about his effectiveness off the ball … These few factors will determine how high Tatum’s ceiling is …",80,205,19.32
Josh Jackson,4,"One of the main things that jumps out at you is JJ’s versatility on both sides of the ball … From an offensive standpoint, he possesses a very high Basketball IQ that allows him to be aware of where his teammates are on the court … While he doesn’t play the role of a primary ball handler for Kansas, he’s averaging a very impressive 3.1 assists per game … He gets many of these due his natural knack of knowing where everyone is on the court, and having the touch and creativity to get the ball where it needs to go … His motor also jumps off the page, he’s an elite offensive rebounder for a 6’8’’ wing and is extremely assertive when he’s on the hunt for a loose ball, or rebound … Jackson also has a very solid first step, and the ball handling ability to get past defenders at a level that looks to translate to the NBA … He also plays within himself with the ball in his hands … He’s shown takeover ability this season for the Jayhawks, but for a freshman averaging 15.3 ppg, he’s very controlled, and doesn’t have the tendency to get sloppy for the sake of getting a shot … He’s an extremely disruptive and explosive defender too, with a solid 6’9.75’’ wingspan, which will aid him in his NBA translation … He’s not the type of defender that merely hinders his opponents ability to score, he’s deadly in the passing lanes, and is aggressive trying to steal the ball and deflecting passes … This results in a lot of fast breaks, and easy transition buckets … His shot blocking ability is also very impressive for a wing … Jackson blocks 1.5 shots per game (to go with 1.5 steals) and has the ability to get them in one on one situations, or coming over from the weak side … Jackson has also played 3 positions for Kansas this year ranging from the 2, to a small ball 4 … He looks to only be able to play shooting guard and small forward in the NBA, but he can do so effectively on both sides of the ball … Athletically he’s explosive, quick, and has good lateral, as well as open court speed … His assertiveness, and aggressive tendencies pair with his athletic gifts making him a regular on highlight reels, and this is a valuable quality in regards to team momentum … Has a blue collar work ethic and willingness to do the dirty work, does not exhibit the prima donna attitude often associated with elite level prospects … An extremely competitive and passionate kid who brings a high level of intensity and desire to improve …","Jackson’s biggest weakness right now is his shooting … While his athleticism, and his ability to play within himself leaves him with a .52% FG clip, he’s shooting just 28% from deep, and 54% from the charity stripe … His shot is not broken or beyond fixing, and he does have touch, but it does have a little hitch that will take time to correct … His aggressiveness is more often than not a good thing, but this can render him in foul trouble, which can frustrate him … He’s picked up 3 technical fouls, all due to frustration of foul calls, through Jan 7th of 2017 … He’s picked up 4 or more fouls in 5 out of Kansas’ first 15 games, and fouled out of three, so cutting down on fouls early in games will be key … Jackson is a pretty good rhythm jump shooter, and has real potential shooting off the dribble, so the honing of his shot is key to him taking the step beyond a high level two way role player and an All-Star level player …",80,205,20.38
