Name,Pick,Strengths,Weaknesses,Height,Weight,Age
Jonah Bolden,36,"Versatile player, who – under the right conditions – can be play in all front court positions… Great size and lentgh for a power forward…. He has really long arms and a very good wingspan (measured at 7-3 feet)… Smooth athlete, with very good jumping ability off two feet when he has room to gather… Team player, who plays inside the system… High basketball I.Q… He runs the floor extremely well for a big… Really light on his feet… Impressive ball handling for a player his size… Can start the fast the break as the ball handler and do the coast to coast if he finds room… Great on transition, really knows how to fill the lanes… Stretch-4 potential… He has a nice looking shooting stroke… Can Shoot the ball well from the perimeter, going all the way up to 3-point range… His mid-range game is really solid… Excellent on Pick and Pop situations… Can Play the Pick and Roll as the screener at a very good level… Solid on creating his own shot… Has a good Pull Up Jump shot as a counter move… Can play above the rim… Likes to finish strong at the basket…. Puts the ball on the floor and attacks closeouts thanks to his athleticism and solid first step… Very good passer…. Posseses great court vision and sees angles that are rare to be seen by bigs… Moves well without the ball… Very good rebounder, who is not afraid to bang bodies… Relentless on the offensive boards, puts a lot of presure on the opposing team… Great lateral quickness… He can switch on a perimeter player while defending the Pick and Roll with ease and hold his ground…. He is a great shot blocker, with good instincts… His length, defensive instincts and above average athleticism make him a good rim protector… Covers a lot of ground on defense with his length and athleticism and contests shots… Has active hands on Defense, which helps him make a lot of steals… Very good weakside defender…","He really needs to add strength, especially on his upper body… Very good, but not an elite athlete… The fact that he needs room to gather before jumping can be a problem at the next level… He might play inside the system, but this could make him look passive at times on offense… He needs to learn when to step up for his team… His free throw shooting was bad in 2016/17 season (below 60%), which is kind of bizzare considering he was shooting in the low 40’s from 3-point range… He doesn’t go to the line as often as you would expect from a guy with his skillset… Has the tendency to settle for mid-range and long range shots instead of going all the way to the basket… Has problems creating his own shot against athletic defenders… Seems to prefer to Pop out after he sets a screen rather than Roll hard to the basket…. He doesn’t establish position in the Post and can’t really exploit any miss-matches… His Post game is just average and doesn’t have enough counter moves… At times he tries to do too much with his ball in his hands, either by forcing a difficult pass or make one more dribble than he should, which leads to turnovers… There are moments he puts his hands down when he tries to block a shot and as a result he commits bad fouls… Holds his ground in the post on Defense, but he can’t really contain strong, physical players… Can lose focus on defense, and be too concern looking at the ball…",82,235,21.48
Semi Ojeleye,37,"Ojeleye is a physically developed forward at 6’7” and 235 pounds with excellent versatility … He can handle the ball in the open court and make shots from the perimeter both spotting up or on the move … He is also a solid shot creator in the half-court, and he gets to the free throw line frequently by using his combination of strength and mobility … Ojeleye may be a valued later pick in this draft, as an explosive combo forward that can stretch the floor, create his own shot and be a factor defensively … Ojeleye has become an excellent stretch four-type player at SMU, something he did not have many opportunities to exhibit during the early stages of his career at Duke … He shot 42% from the arc this season while attempting almost five three-pointers per game … Ojeleye’s work ethic is top notch, as he has added multiple dimensions to his game since his time at Duke … He played mostly as a four man in SMU’s offense, so there will be few questions about where to play him in the NBA … Ojeleye can also shoot off the dribble if chased off the three-point line, as he has an effective pull-up jumper off of one or two dribbles … He is mobile enough to attack opposing fours off the dribble with his lethal combination of power and quickness … He is also dangerous as a face up post player, with an excellent face up jumper, and he has crisp footwork from down in this area … Ojeleye averaged 23.5 points per 40 minutes, while shooting 50% from two and 42% from three, showing his ability to play within himself and be efficient … Ojeleye has an NBA ready frame at 235 pounds, and at age 22 he will be ready to contribute immediately … He’s also an outstanding athlete in space with the ability to finish above the rim when he has momentum … He particularly utilizes this ability on the offensive glass, where he has terrific motor to pursue the ball, and often turn missed shots into thunderous put backs … He is not elite on the defensive glass yet, but he does a great job of using his strength to box his man out and carve out space … Ojeleye also is a very good finisher around the basket in part due to his mature frame and quality body control … He is a high IQ player, as he rarely commits turnovers and overall does an excellent job of not forcing the issue and playing to his strengths … He is an outstanding teammate and never tries to do too much … His most likely role in the NBA will be mostly as a mismatch small ball four-man, who can play on the wing occasionally …","Ojeleye is a bit undersized for a power forward even in today’s small ball heavy NBA at 6’7”, and he doesn’t have elite length either at 6’10” (wingspan) … Defensive fit will be a big question mark going forward as he’s not quite big enough to match up with traditional fours, and he doesn’t have a ton of experience guarding NBA-level wings, as a result of playing in the AAC … His instincts on that end have room to improve as well, evident by his low block and steal rates … Ojeleye can also be more productive on the defensive glass (just 5.5 d-boards per 40 minutes) … If he is going to play the four for long stretches in the NBA, he will need to add some improvement here … Ojeleye’s lack of elite size and average standstill leaping will hurt him as an interior scorer in the NBA, and his overall perimeter skill set could use some polish if he wants to play more minutes on the perimeter … Ojeleye is not nearly as explosive in traffic, and he is not a great ball handler for a wing player … He also does not have a great left hand, which can make it difficult to succeed in the NBA without some degree of ambidexterity … Another big question mark will be how he adjusts from the poor level of competition of the American conference this season to the NBA … He did little to squander these questions when SMU had big NCAA tournament expectations, but were bounced early by USC, a team with great size, length, and athleticism …",78,240,22.56
Jordan Bell,38,"Utility player that brings unbridled energy and explosive athleticism as an undersized big man … Instincts as a shot blocker have been present at every level, has great timing, tries to keep it in play and covers a lot of space … Great nose for the ball and gets off the floor really quickly, can rebound out of his area … Has improved his body and skills greatly over his time at Oregon, his work ethic on and off the floor seems evident … Great running the open floor, can finish above the rim and has been a true rim protector … Threat to score near the basket on offensive rebounds, can finish strong jumping off of two feet … Has worked on his post footwork and is effective on up-and-under, right hook over his left shoulder … Very comfortable playing without the ball, sets good screens and willing to do work to try and open the floor for his teammates … Showed ability as a passer, makes some good reads out of the low post and very willing to get others involved … Adept in both the passing lanes and tips, did a very good job creating turnovers and had a high steal percentage … Willing to get low and brings a good effort in defending the perimeter … Is someone other teams need to be aware of around the basket, great at blocking shots from the weak side and was counted on as a last resort often on defense … His FT shooting went from barely above 50% to 70.5% as a junior … Has managed to cut down his fouls quite a bit, much more disciplined defender over time … While he is still not relied upon or asked to shoot much, showed a much improved touch and can hit jump shots close to the hoop … Shows solid hands on cutting to the basket with powerful finishes … Plays with great confidence, never was shaken by going up against bigger or stronger players, uses speed to his advantage and is very good at fronting the post … Willing to put his body on the line, consummate teammate … Conditioning has been really strong, played 28.7 mpg at a high energy level … Has gained a great deal of muscle since he has come to Oregon and also improved his skill level to go from a rotation big man to one of the better big men in the Pac-12 conference … Manages to cover a lot of space as a defender, sprints on close outs and gives maximum effort … Knows his role and does the things you want from your big man, rebounds, protects the paint and is up to the task to cover a number of different assignments on defense … Very self aware and will do whatever it takes to help his team win","Has played center at Oregon and seems to be the position in which he best translates, and at around 6’8 with a 6’11-7’0 wingspan, is very much undersized … While he definitely seems to have strength to him, can certainly stand to add weight if he wants to defend bigger, stronger players at the next level … For his rather low usage, can turn it over quite a bit, has issues when taking more than a few dribbles and can force some bad passes … Still not someone that you are confident with shooting past mid-range, seems doubtful he will ever stretch the floor much … Can at times lose focus as far as boxing out, does not always put a body on rebounders … Like most shot blockers, can also go for blocks and therefore be out of position to rebound and give up some offensive boards … Post moves can be a bit stiff and is not necessarily going to be someone you will go to on offense … Was not utilized often in the pick-and-roll, and while he has potential defending it, he still did not have a great sample size of doing so … Much better with his right hand, still struggles on the right block … His instincts as far as a roll man are still sometimes a bit delayed … Has had issues with bigger, stronger players in the post, and sometimes can get sealed when he fronts … While he shot 63.4% FG, is quite limited offensively and is not a huge threat anywhere outside of the paint, not a lot of upside as a scorer",80,225,22.47
Jawun Evans,39,"After a promising freshman season cut short by injury, Jawun Evans came back and further established himself as both a dynamic scorer and distributor in the college ranks … Evans really has a good understanding of operating in the pick and roll, as well as artfully using screens to get a good shot … His ability to run an offense, understand spacing, and create for others will directly translate to the pro game … Jawun is also a strong shooter who hit 38% from deep during his sophomore campaign … His 81% clip from the free throw line, as well as a 48% percentage as a freshman paired with good mechanics and on court smarts would lead me to believe he will continue to improve from beyond the arc … His 19.2 points per contest were achieved on a variety of shots as well … Evans can get to the hoop, operate in the mid-range, and get out in transition. He also has a nice array of floaters and is good at creating space between defenders in order to get attempts up over shot blockers … While not an elite athlete, he is extremely quick and has pretty good lift … A glass half full observation would mention his 6’4’’ wingspan, which is helpful considering his small stature … Evans 6.4 assists per game lead the Big 12 this past season, and he did so with a pretty solid 2.28 assist to turnover ratio … Quick hands, and good anticipation also allowed him to rack up 1.8 steals per game as a sophomore … Evans has showcased the ability to take over games … He went for 25 or more points 8 times this past season did so without sacrificing his distribution duties … Jawun can be streaky as well. When he’s rolling he proved to often be too much to handle at the college ranks, and he does enough outside of scoring he’s still a valuable asset when his shot isn’t falling …","Defensively Evans will have trouble at the next level … While 5’11.5’’ in shoes he does sport a nice wingspan, but he’s not overly strong for his size, nor is he an elite athlete … His effort is a plus, though, but he’ll be easy to shoot over in the NBA … Like many smaller guards, he also projects to struggle in the lane … According to hoop-math.com he shot just 50.4% at the rim against big men that will be much smaller and less athletic than their NBA counterparts … He didn’t enjoy the most efficient sophomore season … It should be noted that he carried a massive offensive load for the Cowboys, but 43% shooting in the NCAA isn’t a good clip, and things don’t get any easier in the NBA … A better shooting freshman season would give hope to turning things around when he’s not expected to shoot 15 times and be the primary ball handler and distributor, but he’ll also be playing against tougher competition …",72,185,20.92
Dwayne Bacon,40,"Athletic player with solid size for a wing (6’6”, 221 lbs, 6’10 wingspan, 8′ 7.5” standing reach) … Knows how to use his body for positioning … Takes advantage of smaller defenders … Attacks any perceived mismatches … Has the requisite strength to guard bigger players on switches … Possesses natural scoring instincts … Knows how to create his own shot … Can break down his defender one-on-one … Capable of willing himself into the lane … Finishes well through contact … Makes something out of nothing on offense … Ability to make tough shots … Plays well in transition … Has the speed to fill the wing on a fastbreak … Explosive leaper and fluid athlete … Capable ball handler … Comfortable running the pick-and-roll … Has an array of moves to use in the midrange areas … An active defender when he puts his mind to it, and shows solid potential on that side of the floor … Made plays in passing lanes … Adept at stripping the ball away in the paint … Can guard wings and stretch-fours on defense … Will be most effective as a third option or scorer off of the bench in the NBA … Plug-and-play type of talent at the next level … Has an NBA body with the ability to make plays through contact …","Has the physical attributes to become a good defender but does not always show the same intensity on that end of the floor … Must work on fundamentals and get lower, and get his hands up at all times, to be in a ready position … Too often opponents get clear looks simply because he’s late to react and doesn’t challenge them by keeping him inside their area … His NBA playing time will be zero if he cannot correct these simple fundamental issues … Not a consistent threat from the perimeter … Unnecessarility forces the action sometimes … Decision making should be better at his age … Will put his head down and attack instead of moving the ball to soften defense … Gets dribble-happy from time-to-time … Falls asleep off the ball every now and then … Old for a sophomore (will be 22 by the beginning of the 2017 NBA season) …",78,220,21.83
Tyler Dorsey,41,"Dorsey ended his Oregon career on fire, leading the somewhat depleted Ducks all the way to the Final Four … He finished the year with eight straight 20-plus point games, while earning the nickname “Mr. March” for his stellar play in big games … He continued his momentum into the NBA Combine, where he posted per 40 averages of 21.6 points, 8.5 rebounds, and 5.9 assists on 56% shooting from three-point range in two games … Dorsey’s play over the last few months has vaulted him into an intriguing possible second round option for any team looking to add shooting off the bench … Dorsey’s elevated draft stock begins with his outstanding scoring instincts … He shot an excellent 41% from distance in his two seasons with the Ducks and is also an excellent shooter off the dribble … While he is not an explosive athlete, he makes up for it around the rim with soft touch and craft to convert a high percentage (57.3% at the rim) of his looks inside. He does an excellent job of spotting up in transition as he has a knack for finding open spaces on the court to get his shot off, where he has deep range that should translate to the NBA arc … He gets his feet set quickly as well, and his mechanics stay consistent with a hand in his face … Dorsey also does a great job of running off screens to get his shot off and looks very comfortable shooting on the move … Off the pick and roll he consistently demonstrated the ability to make defenders pay for going under the ball screen with his pull up jumper … One also has to appreciate that he never loses confidence in his shot and that he does not need much space at all to get it off … At the rim, he uses a lot of shot fakes and has excellent footwork to get his shot off, or draw contact and get to the free throw line (75% conversion rate) … It is primarily Dorsey’s shot making and ability to get hot in a hurry that gives him great potential as a role player in the NBA … With NBA spacing he could thrive as a shot maker and secondary ball handler off the bench. Dorsey is not a true floor general, but he did play a lot of point guard for Oregon, so he has experience running an offense … He is also improving as a playmaker, as he has decent vision and does not turn the ball over that frequently … He operates well out of the pick and roll and has shown flashes of making good reads to set up his teammates … Dorsey particularly showed during the NCAA Tournament that he is unusually poised in big moments and that he can be depended on to make big plays when it counts … Any potential playoff team that may draft him would really appreciate the mental aspect of his game … If Dorsey can prove that the NCAA Tournament was not a fluke and that he is really beginning to put it all together, he could carve out a nice career for himself.","The most concerning aspect of Dorsey’s game is his less than impressive physical tools for an NBA two-guard … He checked in at the NBA Combine at 6-4.5 with an even more underwhelming 6-5 wingspan … He also weighs just 183 pounds, so he may struggle to get to the rim and finish against bigger, physical guards … This will likely prevent him from being a multi-positional defender at the next level … His lack of length will limit his effectiveness to guard on the perimeter and be active in passing lanes … He has already shown limitations in this area, averaging just 1.1 steals per 40 minutes in two seasons at Oregon … With his physical profile, he is probably best suited to guard point guards, but he may not be quick enough to do so given how explosive modern-day NBA point guards are … Dorsey also does not show a great deal of competitiveness on this end of the court either … When switched onto bigger players he does not battle for position persistently … He also tends to have some frequent lapses off the ball, losing shooters on the wings or giving up easy backdoor cuts. Dorsey does not project as an advanced shot creator at the NBA level either. Given his average explosiveness and shiftiness with the ball, he can get forced into some difficult shots, and he will probably have trouble finishing around the rim against NBA length/athleticism. Much of his shot selection comes via difficult contested shots given his lack of creativity with the ball and his less than ideal physical tools. He can be out of control going to the rim as well and force a lot of wild shots at the basket instead of looking to make a play for someone else. Dorsey is not a very willing passer either, which can cause him to be inefficient at times. It appears that the majority of his NBA impact will be contingent on his shot making ability. However, if he can’t get hot from the outside, NBA teams might worry if there is anything else he can bring to the table.",76,185,21.37
Thomas Bryant,42,Thomas Bryant possesses incredible length (7’6” wingspan and 9’4 ½” standing reach) … Measured in at 6’11” with shoes at the 2017 NBA Combine … A threat from the perimeter … Smooth shot and form … Should be able to hit open looks from the NBA three-point line … Effective around the rim … Good finisher inside with a couple of post moves in his arsenal already … Length makes him a monster on the offensive glass … Can play through and above a crowd … Finishes above the rim despite not being a tremendous athlete … Gets up and down the court when engaged … Powerful dunker in transition … Really fast in the open court … Uses what advantage he has over defender to score … Comfortable playing away from the rim too … His combination of size and outside shooting are needed in today’s NBA … Young for a sophomore (19 years old and won’t turn 20 until September) …,"Poor defender … Did not rebound as well on the defensive end as he did on the offensive end … Would not initiate contact or box out opponents much instead relying on his length to try and snag rebounds over players … Not the most mobile defender either … Just a stiff player laterally … Really struggled to defend pick-and-roll during his two years as a Hoosier … Still raw offensively in the post … Left hand is very weak and he does not use it often … Is not going to create his own offense … Not an explosive athlete … Will not wow you with his vertical ability … Lack of basketball IQ and feel for the game … Very turnover prone … Too often puts his head down and tries to force the action either with a shot or a bad pass … Has the length to deter shots at the rim, but has yet to prove to be elite at that part of defense …",83,250,19.91
