Name,Pick,Strengths,Weaknesses,Height,Weight,Age
Paolo Banchero,1,"Has good size and length for his position, standing 6’10”, 250 lbs … Has a good blend of strength and athleticism / fluidity … Moves well with and without the ball … Solid all-around player that can do a bit of everything … Stand out at creating shots for a player his size … Has a rare mix of moves for a big man – is comfortable crossing his defender up, making spin moves, and is able to remain on balance when attacking off the bounce … Excellent body control, and uses the body well to shield the ball from defenders on his shot attempts … Shot 33.8% from three during his year at Duke and projects to be able to make the NBA three with consistency due to solid mechanics and fluidity in his jumpshot. Is able to shoot off the catch or create for himself off the bounce … Is especially dangerous as a trail man where he can shoot the three or attack a late closeout from a defender … Possesses excellent footwork, especially in the post, that allows him to remain on balance and create advantages for himself by getting defenders out of position … Can score in a variety of ways in the post … Has a fadeaway jumper that is extremely difficult to contest, and can hit it with regularity … Uses his strength to power through contact and scores despite being fouled regularly … Can play above the rim and likes to finish plays with dunks instead of layups … Is not a selfish player, averaging 3.2 assists per game for his college career … Is comfortable playing as a roller or popping out looking for a jumper or driving lane when playing the pick and roll game … There really isn’t much he can’t do on the offensive end of the court. Is an instinctive player who reacts quickly and naturally to what opponents throw at him … What he lacks for in run/jump athleticism, he makes up for with dexterity, coordination, body control and great feel for the game …","For all of his offensive gifts, still has room to improve defensively snd may never be better than decent on the defensive end … lacks later quickness to defend on the perimeter … He doesn’t provide much rim protection, averaging less than a block per game … Will likely need to play center at the pro level, at least defensively to compensate for his lack of lateral quickness … He can struggle with turnovers, as he had 4 or more in 11 of his 39 games at Duke … Would like to see him shoot a bit higher than 72.9% from the free throw line … His outside shot can be streaky, which is good when it’s hitting, but not so much when he misses a couple early …",82,250,19.62
Chet Holmgren,2,"Extremely skilled frontcourt player who can initiate offense at every level of the floor … Has shown flashes of going coast-to-coast in the open floor, taking his defender off the dribble and getting to the rim before the opposing defense gets set … Great size (7-1) and long arms (7-6 wingspan) allow him to alter and/or block just about every shot taken in his vicinity … Elite interior defender in college who makes up for his lack of strength with length and tremendous timing in the post, though he’ll need strength to not get pushed around… Fluid shot motion and quick trigger allow him to dominate in the pick-and-pop game whenever his shot is on … Shot 39% on the season from beyond the arc, including 45% from early December until the NCAA Tournament … Can play both on and off the ball on the offensive end by attacking less mobile centers and generating space in the half-court offense with the threat of his outside jumper … Can attack opponents off the dribble and make bigger defenders pay who close out aggressively. His quick trigger and ability to put the ball on the floor make it nearly impossible to defend him fading away off screens. Long strides allow him to get from the perimeter to the rim with only one dribble and a spin … Generational talent who is bound to fill up a highlight reel every time he plays … Tremendous lateral footwork that allows him to defend 1-5 and alter almost any shot on the floor … Can pass with his back to the basket in the post and sitting at the top of the key reading off-ball movement … Decent rebounder who can get out and run any time he brings down a defensive board … Has the ball-handling and speed to lead the break in transition immediately after pulling down a rebound … Sky high  potential due to his measurements and skill set at only 20-years-old. Could become an Anthony Davis type of two way dominant player if he can fill out his frame and stretch his range while remaining consistent from beyond the arc … Impressive basketball feel and IQ for a young bigman. He can become a special NBA  player if his body develops and he can stay injury free …","Lack of physical strength (195 lbs) remains his biggest hurdle. Whether or not he can add significant weight and maintain his agility and mobility is a big question mark … While his combination of length and agility is extremely rare, it’s hard to imagine him being able to play on the perimeter as a facilitator as his size will eventually slow him down with time and age … Without better body strength, durability is a factor … More physical players can bully him under the rim and take away his length by getting him out of position and also attack him as long as they keep their dribble and put him into these difficult positions … Doesn’t get fully engaged on screens and shies away from contact, which limits the amount of separation his ball-handlers can get in this action … Struggles to stay out of foul trouble with nearly 4 fouls per 40 minutes in only season at Gonzaga … Didn’t put up great numbers against elite competition and disappeared for large periods at a time in these big games … 71% from the Ft line gives some pause to the idea that he’s an elite shooter … Appears that he can be an 80% FT shooter in the NBA due to his form and touch, but his college numbers did not prove that … Impressive shooting numbers from three giving him obvious intrigue as a perimeter scorer, but he did hit just 41 threes on the year and 1.3 per game (a low volume) and against a lower caliber of opponents playing in the WCC …",84,195,20.16
Jabari Smith,3,"Wiry 6’10 combo / stretch four with long arms that allow him to shoot over defenders and be effective at all three levels … Among the best pull-up jump shooters in the country, particularly from beyond the arc and just inside the arc. 44% three-point shooter on over 5 attempts per game through 17 games … Has the length and size to elevate above most defenders and knock down jumpers whenever he gets to his spot …. Active, relentless defender with disruptive wingspan and good lateral quickness … Shows solid instincts and anticipation and gets blocks and steals without gambling … Versatile defender … Can switch onto 1-5 as a solid on ball defender on the perimeter and also holds his own in the post … Shows good feel as a help defender as well … Averaging 1.5 steals per game and around a block per game … Plays with a high level of energy at all times … Intelligent decision maker … Really seems to have a solid understanding of the game and plays with a lot of poise and maturity for a freshman … Also gives a high level of consistency with his effort and focus … Quality free-throw shooter (80% FT) , which is encouraging for continued success as a shooter at all three levels … Long strides and a quick first step allows him to get by most similar sized defenders with ease and gets to the rim in a flash … Good cutter who finishes lobs and layups around the basket with high efficiency … Elite athlete who can ignite a crowd and offense with flashy, powerful dunks in transition … Protects the ball with only 1.8 turnovers per game despite high usage rate (27%) … Stays out of foul trouble even with his aggressive, energetic, physical defensive style … Well-rounded two-way forward with great size and length combined with high degree of potential … Has the versatility/mobility to play as a small forward in big lineups, but appears best suited for the 4 position with his ability to create mismatches and rebound … Ability to defend the perimeter at his size is an added dimension missing from the other top bigs at the top of this draft … Emerging as potentially the top prospect in the top-heavy 2022 class as perhaps the safest floor combined with an intriguing ceiling …","Rebounding numbers could stand some improvement (6.2 per game), granted he’s playing away from the rim at times and has an elite bigman that he is sharing the front court with (Walker Kessler) … Added strength will allow him to play more physical around the rim … Average ball-handler who struggles to get to the basket on his own … If he can improve as an ISO guy it will open up his outside game further …. Decent passer but could improve in this department as well … Often settles for perimeter jumpers or lower percentage mid-range jumpers because of his reluctance/inability to get to the basket and create for others in the half-court offense … Still a small sample size offensively, but the physical traits are there to sustain efficient success with his jumper … Doesn’t create a ton of space for himself when he catches entry passes at the elbow. Usually settles for mid-range jumpers upon these entries … When he does drive, it is almost exclusively to his right as his drives to his left often end in turnaround jumpers … Needs to become a better ball-handler in order to improve upon these weaknesses …",82,220,19.13
Keegan Murray,4,"A 6’8 225 frontcourt player with the frame, length, and mobility to play minutes all along the frontcourt in the NBA, especially as he fills out his frame … Agile; moves well laterally and has pretty decent leaping skills too, gets off the floor quickly off one or 2 feet … A smooth frontcourt player with the ability to move better than many similarly sized players, making him a big mismatch offensively at the college level with some translatable skills to the pros … Very good floor spacer, has a soft shooting touch and consistent shot mechanics from all 3 levels of the floor, and can do damage spotting up and hitting shots from long range (nearly 40% 3FG on 4.7 attempts), pulling up off the bounce and attacking closeouts, or using turnaround jumpers from the low or mid post … Also is effective in pick-and-pop situations, and shows budding ability to hit some jumpers with range off screens … Possesses a rangy 1st step that college frontcourt players struggled to defend all season when he attacked off the dribble, and knows how to slither in tight spaces or spin into the lane under control for high percentage shots when defenders happen to cut off his driving lanes … Solid post-up player, particularly when matched up on smaller players, and has a good command of jump hooks & up and under moves when he establishes position … More of a finesse player than physical, but shouldn’t be confused with a player who is afraid of contact in the paint, and will occasionally finish with authority at the rim … His huge production jump from his Freshman to Sophomore season (from 7.2 ppg to 23.5 ppg) is eye-opening and encouraging; but his shot selection to get that production was also outstanding (55% FG, career 54%) and he rarely looks like he’s forcing scoring opportunities outside of the offensive flow … Looks comfortable as a ball handler initiating transition opportunities after missed shots or turnovers … Will make some hustle plays and is active moving without the ball, gets a fair share of points without having plays drawn up for him as a cutter and in transition … Rebounds his area well (nearly 9 rpg), but is particularly effective as an offensive rebounder (nearly 3 Orpg as a Soph.) who regularly got put backs by being active on the glass and using his long arms … Effective shot-blocker (nearly 2 bpg as a Soph, career 1.6 bpg) showing nice timing and using his length to alter shots near the rim or get back into plays when beat off the bounce … Moves his feet well, rarely gets in foul trouble, and also has quick hands (over 1 spg); has the tools needed to be able to switch onto the perimeter and hold his own and sometimes even smother smaller matchups while guarding along the frontline as well … Gets to the line at a decent clip (over 5 attempts per game at around 75 FT%) … Doesn’t turn the ball over much (just 1.1 topg), especially for his usage … High IQ player and late bloomer who clearly works hard on his game giving his emergence from his 1st season to now …","Will have some questions about his true position at the next level; though his length allows him to play bigger than he is, at 6’8 he may be better suited as more of a PF or ‘small ball’ C than the combo forward he is seen as at the college level, especially as he fills out his frame … For as productive a scorer as he was for Iowa as a Soph., Murray didn’t quite prove to be a natural perimeter shot creator … Is comfortable handling in the open court and he’s hard to contain in the mid and high post, but he can be loose with the ball from the perimeter off the dribble and it’s tough to project him facing up and breaking down NBA level combo forwards on the perimeter consistently … Was an efficient shooter, but did have some inconsistency from deep this season at times and is still improving … Seems to prefer to drive and finish with his right, did have some awkward possessions when that side of the rim was cut off and he had to use his off hand … Defensively, Murray on occasion will rely too much on his length to gamble for steals/deflections by fronting post entry passes with no help around, and it can lead to easier shots in the paint when he’s unsuccessful … May struggle to defend on the perimeter as his lateral speed is not exceptional … May have been a function of his role on the team because he doesn’t seem selfish, but Murray doesn’t pass the ball much … Has underrated strength, but did at times struggle with his efficiency when defended by physical match ups who could contain his dribble penetration … Older than your average Soph. after spending a year in prep school before attending Iowa, will be 22 years old at the start of his rookie season …",80,225,21.86
Jaden Ivey,5,"An aggressive explosive, 6’4 200 lb combo guard with solid length (wingspan rumored to be somewhere in the 6’7-6’9 range) and a strong frame that should allow him to match up well on the perimeter … Very quick-twitched, Ivey is a premier athlete in the 2022 draft class who runs the floor exceptionally well given his outstanding burst and speed, and has the explosive leaping ability off of one or two feet to play above the rim with ease … A terror in the open court, plays with a high motor and is always looking to attack and put pressure on the defense; whether filling the lanes for off ball run outs or handling the ball in transition himself … Attentive off the ball and will slip behind defenders for easy cuts to the rim if his match up is late to react/out of position..Finishes well at the basket even when contested amongst the trees, has enough power and touch to score through contact … Makes good things happen when the defense isn’t set but only needs half a step on his man to collapse the paint and get to the rim in the half court with or without a ball screen due to his very quick 1st step and long-striding speed … Ivey is comfortable driving and dishing and in pick and roll situations (especially going right); rewards Purdue’s big front court players with plenty of high percentage looks near the rim off the attention he gets from slashing (3.3 apg as a Soph.) … A really active, quick-handed defender who plays strong on-ball defense at the college level, but is just as adept at jumping passing lanes and causing deflections, likes to flip turnovers into points … Has the athleticism needed to get back in plays after getting beat, capable of making nice chase down blocks … Projects very well to being able to defend anywhere on the perimeter at the NBA level given his physical tools and intensity level, and is among the best overall defenders in this upcoming class … Also a willing rebounder (5.2 rpg) who looks to initiate offense off missed shots..A rapidly improving 3-point shooter (41% 3FG currently as a Soph. on 5 attempts per game, up from just 26% last season) who has made defenses pay when they give him space this season … Ivey possesses decent release speed and touch; has shown flashes of being able to make shots on the move using screens, but especially off the bounce and spotting up with his feet set … Has a couple of rangy step back moves he uses for separation at times to get his shot off … Sporadically uses runners and floaters in the mid-range area, both shots that would be useful to continue to develop considering his play style … Has become a very difficult match up at the college level with his improved shot, as it only adds to the pressure he can put on the defense and puts his matchups at his mercy for blow-bys when closing out on him … Rapidly improved overall scoring efficiency (just under 40% FG last season to 48% on increased volume so far as a Soph.) points to a hard working player who is playing to his strengths while putting in the time to improve his game elsewhere…Has fan favorite traits, given his energy level and highlight reel athleticism, but also will endear himself to coaches and teammates with his contagious effort and solid intangible traits…Gets to the foul line at a decent rate and is an OK FT shooter once he gets there (career 74% on just over 4 FTs per game)","Ivey’s hard charging energy and play style can be projected to be both a gift and a curse, as he can also straddle being too aggressive and being out of control on both ends … Gambles and reaches for steals and will pick up unnecessary fouls or get himself out of proper position, washing himself out of plays at times … High IQ players will undoubtedly be able to have some success using his aggressive approach against him, whether it be stepping in for charges or baiting him into live ball turnovers by getting caught in no man’s land … Offensively, if his speed doesn’t break down the help side level of the defense, he occasionally shows questionable patience and shot selection … Can stand to improve on switching up the pace he plays at more often … Should look to polish his mid-range game, would benefit from adding 1 and 2 dribble pull up shots when chased off the 3-point line …Improved passer but not quite a natural playmaker for others (3.3 apg/2.2 topg); leaves his feet to make passes often, which telegraphs and will allow  defenders the time to recover and close passing angles more quickly … Has some misdirection in his game, but is mostly an average ball-handler who prefers to use his speed and rangy strides to maneuver … Gets low lift on his jumper and shoots a set shot, which is less of a concern for him from the 3-point line given the improvement and shot-making range he’s shown this season, but it will likely make the development of his floaters and runners more imperative at the NBA level … Some consider him a potential point for the next level, but for now he is more of a wing than a true lead guard …",76,195,20.37
Bennedict Mathurin,6,"6’7 wing with tremendous size, maturity, explosiveness and scoring skills that should help him make a quick transition to the next level … Elite spot-up shooter who can flourish in a lesser role early in his career before making strides to stardom later on … Shows some ability to utilize a floater … Aggressive slasher with a quick burst and powerful first step … Finishes with good strength and tremendous body control … Rim punisher who can bring the house down with athletic and pulverizing poster dunks (ie dunk vs TCU) … Plays with a ton of energy off the ball on offense with great cuts … Extremely athletic wing with good size for a scorer and long enough arms to be disruptive when he is locked in defensively … Sensational athlete who can elevate with anyone and really run in transition … Everyone on Arizona knows how to cut, but his change of direction is elite and he can create a lot of separation for himself in this department … Excellent form on his shot, with crisp mechanics and a consistent form … Incredible shooting range and big-shot maker with a ton of confidence (also see TCU game) … Good feel for his mid-range jumper and also makes decent reads in pick-and-roll action at the free-throw line … High energy offensive player who can crash the offensive glass with an NBA frame and plenty of upside at just 19-years-old until June … Clutch. High intangibles guy who really elevates his play in big situations … Very determined, hard working player as his immense improvement illustrates … Despite some lapses defensively, shows a ton of upside as a defender due to his athleticism and determination …","The biggest hurdle for Mathurin at this point is his inability to create offense consistently off the dribble … Defensive effort and intensity is  inconsistent … Still growing and learning the nuances of playing on the wing …  Doesn’t always work hard on box outs and can surrender a ton of offensive rebounds … Could struggle with high energy offensive players as most of his effort comes on the offensive end … Gets lost at times on the defensive end due to ball-watching and can get bullied when he does engage on box outs … Needs to show more energy in transition defense … Free-throw percentage took a dip from 84% to 76% but his volume went up and his mechanics are still sound … Lateral quickness and anticipation is a step behind on defense with smaller guards able to blow past him … Self-creation will need some time to develop, but he has the tools and potential to make this a strength in a few years time … Doesn’t possess the biggest wingspan, but appears to have solid length, with a wingspan likely a few (2-3) inches longer than his height …",78,205,20.02
Shaedon Sharpe,7,"An incredibly athletic wing who ranked as the top prospect in the 2022 recruiting class before reclassifying into the 2021 class and enrolling at Kentucky in January … An elite run/jump athlete with very good strength to play through contact and play physical … Against high schoolers showed three-level scoring ability and sound shooting mechanics … At  6’6, 210 pounds, Sharpe has a good NBA frame with potentially more growth on the way … Tremendous length with a near 7-foot wingspan … Big, strong hands give him excellent control of the ball … Versus high school kids, showed the ability to move well laterally on defense to stay in front of opposing ball-handlers and has long arms to create steals and disrupt offensive action … Shows good self-creation ability with tight handles and a step-back jumper that allows him to create a ton of separation … Has developed a patented fade to his jumper that gives him more space to get his shot away … Certainly has NBA range on his jumper that he showed during the EYBL tournament … Can seal off in the low-post and has a scoring arsenal with his back turned as well in the high post … One of the highest upside players available for this year’s draft …","Focus, intensity and maturity remain mysteries … Has some incredible high school footage, but these highlight clips can be misleading as they do not include the entire picture … Hasn’t played a competitive game since the 2021 Nike EYBL, making him a huge question mark in the upcoming draft … While there’s obviously a lot to be excited about, having seen him rise to being ranked by many as the top player in high school, the fact that he hasn’t proven it against a higher level of competition, at the college or G League level, is concerning … A real leap of faith pick if taken in the top half of the lottery … Gained a reputation in high school for not always bringing a high level of intensity and effort … Still extremely young and could have a long learning curve ahead of him … Quickness is solid, but doesn’t appear to have blow by speed to get by opponents off the dribble … Reclassifying athletes have struggled with the college game but Sharpe will have to make an even larger jump to the NBA game … Lack of true competition makes it more difficult to project him as a player, not to mention what kind of team player he is … Shot selection was questionable during his time at EYBL … Three-point shot could take some time to become efficient, has the tendency to try to shoot himself out of slumps, which won’t fly without solid production in the NBA …",77,200,19.08
