Name,Pick,Strengths,Weaknesses,Height,Weight,Age
Justin Lewis,-1,"Great length for his position, has the power and frame to continue to develop his NBA body … Has small ball five potential … A good spot up shooter in the mid range with some ability to extend out to 3 … Also uses his length well to finish on the break … Doesn’t mind getting physical on both ends of the floor – isn’t afraid of contact and brings a gritty presence to the game… Has no problem doing the little things that don’t show up on the stat sheet if it means having an impact on the game and the team … Has solid leaping ability, can get to the rim off 1-2 bounces from beyond the arc – strong strides to the basket help him elevate, can run the floor – files the lane and the corners correctly in the fast break makes defenses pay for long rebounds and live ball turnovers, abilities above the rim with momentum help his ability to play off ball and cut to the basket, can defend multiple positions and can defend without fouling..won’t get pushed around in the post by big men and does a good job of walling up when being backed down, is going to make his assignment work both on and off the ball when engaged and can force players into low percentage jumpers, high upside as an individual and team defender…Should be able to guard at least 3’s and 4’s but has the potential to guard one through five if he focuses, is serviceable in the pick and roll … Not a rim protector but contests well and has shown he can block shots in a team defense setting – has proven to be effective as the helper from the weak side, rebounded at a great rate for his position and this should be the most translatable skill to the next level understood position on both ends and stayed strong on box outs … Good catch and shoot potential, is effective when he receives the ball in rhythm but also has the confidence to shoot over smaller defenders – size and a high release point make it hard to block his shot or contest his vision, in transition he can walk into a three and keeps defenses honest on what to guard (the drive or the pull up), good pick and pop potential a growing part of his game, strong in the post and his spin move gets him to the basket, really strong on cutting layups, doesn’t allow defenders to get him off his line of attack, can use his power to get to his spots and isn’t afraid of the moment.","Just 6’6.25″ barefoot but his 7’2″ wingspan makes up for his lack of height …  His length gives him potential, but still struggles with consistency on the defensive end … Lacks the foot speed to defend wings on the perimeter … Can improve his focus and attention to detail on defense, seems to get a bit out of sync at points and comes out of his stance allowing both guards and forwards an opportunity to blow by with a weak recovery… Should work on discipline when it comes to contesting shots and pump fakes, seems to over-commit and bite leading to bad fouls or easy baskets, becoming more engaged on and off ball will only increase his defensive strengths … Time will tell how many positions he can guard at the NBA level, the hope is that he will be able to adequately guard 1-5 but this will depend if he can kick his current defensive tendencies, pace of play and the speed of smaller guards will be a real test for Lewis to see how he measures up … In college it seemed like he was sometimes a half a step slow especially when faced with speed or trying to recover … Welcomes contact but can continue to improve his finishing ability … Wasn’t nearly consistent enough around the rim for his size, strength and wingspan … Should continue to improve as he grows, his jumper comes off strong from his wrist at times … Shot is still a bit erratic … Feels like his mechanics can be better but would only be a minor tweak, has a real dependency on his right hands that at times forces him to take lower percentage shots around the rim, even when he is finishing on the left side of the court or spinning back toward the left he is using his right hand … Needs to develop into a better finisher with both hands, not going to beat a defender one on one with dribble moves is much more power than finesse or speed with the ball won’t create a high level of separation for himself at the next level, ball handling is a bit loose and really struggles with more than one defender bringing pressure, hard to maintain control of his dribble in traffic, will turn the ball over in the post when doubled as well, no real play making ability and hasn’t shown much growth in the area … Has shown a few flashes but overall he has a low level of court vision when facing pressure in the post and puts his head down on drives missing open teammates in both situations, had more turnovers than assists this year and will have to work on staying calm in the post and on the drive … Can develop these aspects of his game but will be a real challenge going forward …",79,235,20.21
Jamaree Bouyea,-1,"Bouyea dramatically improved as a three-point shooter in his fifth year at San Francisco and it is improving his draft stock nearly halfway through his final season … He is best offensively at creating space for himself and getting to the basket with his long strides and tight handles … Really good offensive footwork and deceptive first step that can allow him to fake defenders out and attack the other way … His change of speeds and crossovers on the drive are lethal and often get him exactly where he needs to be attacking the basket … Great body control in the air which allows him to finish around big men in the paint … Solid overall speed to create separation and a quick burst off the dribble … Good cutter off the ball … Rebounds well for his size and position with over five per game … Truly defines what limitless range means as he is comfortable taking threes from NBA distance whether he is stepping into them or stepping back off the dribble … Comfortable shooting off the bounce and as a spot up guy on the wing … Has improved his shooting percentages at all three splits each season in each category … Should be one of the most NBA ready players coming out of college given his experience and consistent development each year … Defensive pickpocket that makes up for his lack of size and strength on the defensive end … Microwave scorer who can put up a lot of points in a short amount of time when he gets into a rhythm … A true point guard who can pass and create scoring opportunities for teammates, but is asked to score more often due to his talent level and role within the team …","Doesn’t get to the line as much as he should for a guard who primarily looks to get to the basket … Lacks elite athleticism and explosiveness for a smaller guard. Dunks are rare unless it is on a one-man fastbreak showing his lack of elite leaping ability … Doesn’t have elite size at only 6’2 and could struggle on the defensive end at the next level … This lack of size is also concerning considering he is a guard who looks to score before he looks to pass … Needs to improve as a playmaker and passer if he wants meaningful minutes as a role player point guard … Doesn’t get a lot of elevation taking his jumpers … Almost all of his three-pointers come with both feet still on the ground and a small jump off the ground … Lengthier defenders at the next level could easily contest and alter his shots if he doesn’t have considerable space to release his shots … Hasn’t played against elite competition for his entire career. Struggled against the powerhouses of the WCC (2-13 from 3PT in 5 games against Gonzaga the last two years) … Will be 23 years old when he first steps onto an NBA floor … A/TO efficiency has fallen off from last season. He is shooting better, but his 3.8/2.4 efficiency from a season ago has dropped to 3.6/3.0 this year …",73,170,23.01
Jean Montero,-1,"A natural scorer, the Overtime Elite guard has shown that he can finish around the basket, stop on a dime and shoot in the mid-range or create his own shot from behind the three point line …  In transition and on the offensive side of the floor is where Montero truly shines … Playing at the international level has improved Montero’s ability to make the right decision when leading the offense … A crafty playmaker … Unselfish passer … Add to the mix that he is a good free throw shooter … On the defensive side of the floor, Montero has proven he can get into passing lanes and create easy transition offense for himself or his teammates … As he continues to grow he should become a better overall defender at his position … Playing at the international level has increased Montero’s ability as a floor general, who has proven to usually make the right decision when running the offense … He generally appears under control and even when the opposing team is trying to trap or double team, he takes his time finding the open man  … This is especially true during his limited appearances for Overtime Elite, Montero was controlling the game the same way internationally … Born in July of 2003, Montero is one of the younger players in this year’s draft …","Montero lacks standout length (6-2 with a 6-4 wingspan), explosiveness and quickness … At 175 lbs, he is in need of strength in order to finish plays and handle the physicality of the next level … He has yet to standout and prove himself against a high level of competition and question marks remain about his ability to run a team and score on elite athletes because of this … Montero is clearly not playing against competition close to his ability. Which leads to the question of if he is being challenged, which likely means that he isn’t going to drastically improve any aspect of his game this season, aside from confidence, while the rest of his class is progressing, playing in college, overseas or with the Ignite … Going forward he should work to become more involved on the defensive side of the floor … Even though he excels at jumping passing lanes, this also leads to gambling for balls when he should be playing his man … In his recent games for Overtime Elite he has been a bit too straight up … He also has a tendency to let his defender slip by him with or without the ball … This is especially true in the pick and roll as ball handlers seem to be able to get downhill on Montero with ease, raising questions about his ability to defend high level guards in the NBA … As he improves on the defensive end, he will also have an opportunity to develop further on the offensive end. Even though he has already been shown as a quality decision maker, improving his shot from range will help his effectiveness as a scorer …",74,170,18.99
Iverson Molinar,-1,"An underrated prospect in the upcoming draft who can immediately translate as a solid backup point guard with the potential to be a star with elite quickness and speed attacking the basket … Turns the corner with speed on the perimeter and has the speed to get enough of an advantage so he avoids chase down blocks from larger defenders in mismatches … Pushes the tempo in transition and will flourish at the next level in these scenarios … Great understanding for floor spacing and sees these spaces well with timely passes and backdoor cuts to catch off-ball defenders sleeping … Forces defenders to be locked in at all times with his poise and calmness with the ball paired with an elite first step and hesitations that allow him to explode past his man … Prolific scorer who finishes with efficiency around the rim as a 51% FG from inside the arc on 10 attempts per game … Perimeter scoring took a hit in his junior season (25%) after taking major strides as a sophomore (43%) on similar attempts per game. His tremendous free-throw shooting (87%), indicates that the latter season was possibly the fluke and he should provide an outside scoring threat at the next level … Finishing around the rim is his biggest strength, but he can also pull-up in the mid-range and finish in the lane with a solid floater …","The dip in his outside shot is definitely concerning, but as mentioned above, he has the FT% and mechanics to indicate that he can figure his shot out and be successful in the pros … Not a plus defender on or off the ball as he struggles to force turnovers or keep opposing guards out of the lane with a thin and small frame … Could easily be attacked consistently on the defensive end because of his lack of versatility on that end of the floor … Really good passer in the open floor, but struggles to make great reads in the halfcourt and looks primarily to score once he puts his head down on drives … His AST:TO ratio for his career is just over one … He needs to improve as a passer if he wants a consistent role, because he cannot rely on his scoring skills as much as he did at Mississippi State as the star player … Already 22-years old and will turn 23 early in his rookie season … Struggles to impact games to his ability, needs to become more assertive and consistent with his play …",75,185,22.57
Lester Quinones,-1,,,77,210,21.61
Michael Foster,-1,"Finished the year averaging 16.3/9.5/2.5 in 22 contests with shooting splits of 49.8/31.0/76.1, Foster gave glimpses of why he was considered one of the best players in the nation during his high school career … A power forward that has good size and strength for his position and should only become more physically imposing on both ends of the floor as he matures … His physical gifts allow him to be an active rebounder on both ends and get deep into the post when given the chance to back down his defender … While he isn’t an elite leaper or rim gazer, he does get off the ground quickly aiding his ability to win 50/50 balls … In transition, Foster has shown in the past that he can start the break off a rebound but as the season progressed he began deferring to his teammates and playing within his role more often … Understanding how to fill the lane coupled with the coordination of being able to catch and finish around the rim had led to easy transition points throughout the G-league showcase … An offensive minded forward, Foster can space the floor with his occasional three point shooting … While Foster can shoot the three, the majority of his offensive game runs through the post … As previously mentioned, Foster uses his strength to get deep into the post and finish around the rim … Being able to finish on both sides of the block, he challenges defenders every time he touches the ball … When he is not backing his defender down, he has shown that he can create space through a post fade … In addition to his post offense versatility, the relief of not seeing nearly as many double teams as he did during high school allowed his game to breathe … However, based on his past experiences he has proven that when challenged with multiple defenders he remains calm and works through the extra pressure … Currently, his passing ability stands at flashes of playmaking potential which should develop moving forward … If he can expand his court vision and become a playmaker out of the post it will only increase his chances of breaking into a starting lineup during his career … An area that Foster has improved upon and should look to continue to build upon is his ability to play within his role … Taking a step back from being the focal point of the offense has helped Foster understand where to pick and choose his spots …","Foster clearly shows ability and potential but still has areas of his game that he must continue to improve … On the surface his shooting splits show an efficient player but going forward he should look to develop his three point shooting so he can be a true floor spacer at the next level … Currently averaging only one three point attempt a game, additional volume when it fits the flow of the offense should help him improve over time … In addition to his lack of three point attempts, he is only averaging a pair of free throw attempts which is frustrating given the size and strength he has  … Shooting 75% is solid but may be slightly inflated considering his limited trips to the line … This also leads to a question about his offensive aggression when he receives the ball in the post, on many possessions when Foster has position he will back his opponent into the paint and work for a layup. However, if he is met with resistance, he can be forced into taking a bad shot out of the post … While he does have the ability to make fade aways, they aren’t always the best shot on the floor, which should come with developing as a passer … Foster’s jumpshot is fluid and looks to have strong mechanics from the shoulders down, the one question mark that may arise is how far he brings the ball back … His firm breaks down on outside shots … He brings the ball behind his head when shooting three point attempts … This could become less efficient in the NBA as the size, length and speed of his opponents increases … Defensively, he doesn’t have the athletic ability/explosiveness to be an elite shot blocker or rim protector and lacks the length to be a consistent disruptor in passing lanes … Moving forward he should continue to work on his defensive positioning and team defense … He isn’t the slowest defender and can challenge shots but l found himself out of position at times this season.",81,235,19.45
Jordan Hall,-1,A massive point-forward with polished skills and incredible court vision … Listed at 6’8 and has the ball skills and court vision of a point guard … Decent 3-point shooter who isn’t afraid to take shots off the dribble and knock them down … 36% perimeter shooter with over six attempts per game is outstanding for a player with his size … Uses his height to see the entire floor and dissect defenses effectively … Can go on a tear once he sees the ball go in once … Elite potential that you don’t often see late in the first round and into the second round … Should be able to contribute immediately as a playmaking wing … Aggressive with his back to the basket with the size to score on smaller defenders in the post … Matchup nightmare if you line him up in the backcourt and allow him to attack smaller guards … Has the handles to play the point and run offense through him in a second unit … Has a ton of zip on his passes … Smooth shooting motion at the line and on jumpers …,"Inefficient two-point scorer despite his significant size and skill advantage over most of his opponents … Played weaker competition throughout his career … Only averaged two free throw attempts per game, which you’d like to see increase from a player with such a high usage rate. Needs to get to the line more on his drives … Could improve as a scorer inside the arc with mid-range jumpers and finishes through contact around the rim … Doesn’t have elite speed or athleticism, but makes up for it with instincts and a high basketball IQ … Not a defensive liability, but if he improves his lateral quickness and put on some muscle, he could become a solid versatile defender. He just isn’t there yet from a quickness and strength perspective …",79,215,20.45
Dominick Barlow,-1,"A player with a high ceiling and good potential across the board…in the 25 games he played, averaged 14.8/1.5/5.9 adding a steal and block per…good size and wingspan for his position…NBA level frame with the potential to be an athletic NBA wing..good free throw shooter, fluid form which translated to the rest of his offensive game…Can score from mid-range but excels from behind the arc..33% from deep in OTE league especially efficient on catch and shoot opportunities-most comfortable in the corners…Average ballhandler with the ability to run in transition and can take a rebound end to end, in the half court he has the ability to take slower bigs off the bounce and initiate the PNR…Can also act as the screen man with the ability to punish smaller guards on a switch or pop from three…prefers his right hand but can finish on both sides of the rim, isn’t afraid of contact with the potential to improve his finishing ability as he grows…Shooting ability from mid-range and behind the arc allow him to punish late or strong closeouts…Has shown to be reliable in the post and is comfortable taking turn around or getting in deep and pushing it off the glass, good anticipation when experiencing a double team and has proven he can make the right pass/decision under pressure…Off the ball he can act as a floor spacer or a cutter. Has shown he can elevate in transition and on the backdoor…good basketball IQ and instincts on both ends of the floor is always in the right place on the offensive end..runs the floor well without the ball…A good teammate, while he is quiet on the floor tends to lead by example…On the defensive end, he has continued to show promise especially considering his length and size…Has the potential to frustrate defenders with his length and size, can get into passing lanes and has proven to make it challenging on or off the ball when he is focused on the defensive end, has room to grow on both ends of the ball but his improvement from game one of OTE to now has been rapid","The NBA Draft Combine helped identify areas of improvement for Barlow, especially in the 5 on 5’s…Not the most explosive in the half court, has a hard time rising uncontested in the post and recovering/help defenders with momentum have challenged him at the rim…Has a fluid shooting stroke but could benefit from speeding up his release, seemed a bit slow for the speed of the game..while he welcomes contact he isn’t the best when it comes to finishing through it, also seemed to struggle with physicality when being defended.., he doesn’t use his weight/size when finishing, at times he would allow the defender to force him into low efficiency shots – Instead of going straight to the basket creates a tougher look on a fade or when his momentum is going away from the rim – he can learn to use angles to his advantage going forward…these areas could be addressed if he continues to build on his frame…can continue to develop as a passer and playmaker, has shown flashes in a small sample size…Defensive ability could be determined by adjustment to the speed of the game..good hips but seemed to have slower feet when defending other draft prospects – Questions surrounding how many positions he could reasonably guard- currently feels like only forwards – Seems to have a tendency to drift and lose focus leaving him prone bad fouls and over-commitments…Has trouble on the switch out of the picker roll especially against smaller quicker guards…Not necessarily a weakness,but it is hard to gauge the competition he played against in comparison to college of the G-League…it doesn’t feel like he was truly challenged during his season with OTE.",82,220,18.46
Bryson Williams,-1,,,81,235,24.18
Donovan Williams,-1,,,78,190,21.81
Julian Champagnie,-1,"A smooth moving, prolific scorer who averaged nearly 20 points per game in his final two seasons with St. John’s … Great size on the wing and at just under 6’7 barefoot … Good strength and solid frame … Terrific off-ball movement … Can catch-and-shoot with limitless range on the move and in spot-ups … Utilizes solid pump-fake to get his defender in the air and knock down step-back jumpers off the dribble. One of the major highlights of his offensive game … Uses his length (6’10 wingspan) and physicality to rebound well on both ends, as he averaged seven rebounds per game in his three-year career … Experienced prospect while still only 21 years old on draft day … Decent shooting mechanics that doesn’t need too much tweaking, allowing him to start working to improve immediately … Capable of scoring on the outside and attacking the rim, but his interior scoring package won’t be good enough without his perimeter jumper consistently falling … Terrific help defender who seems to elevate more than his athletic testing at the combine suggests. Averaged a block and two steals per game as a junior, which should translate with his prototypical size and length … Takes care of the ball despite high-usage rate as he never averaged two turnovers per game in college … Smart defender who stays out of foul trouble … Decent passer who whips in passes with pace and anticipation","Isn’t a terrific athlete and could struggle defensively against the elite NBA wings he’ll be matched up against … Foot speed isn’t the greatest … His strength is the only athletic component of his game that shouldn’t let him down as he makes the jump from the Big East to the pros … Streaky shooter who really struggled against physical and athletic wings who he couldn’t bully inside the arc and create separation against on the perimeter … Experienced a 5% dip in his 3-point shot and 10% dip at the free-throw line despite similar volume … Doesn’t have terrific upside and most likely projects as no more than a 15-20 minute per game role player in his prime … Can settle for outside shots a little too often in isolations … Relied on his size and length offensively, which won’t fly at the next level",79,210,21.0
