Name,Pick,Strengths,Weaknesses,Height,Weight,Age
Mark Williams,15,"Developing center, rim runner, rim protector with tremendous size and intriguing athleticism … The seven-footer would register the fifth-longest wingspan among NBA centers if his reported 7’7 wingspan is true … One of the most athletic centers at the college level … He uses this length and size masterfully on the defensive end, altering almost every shot at the rim and blocking nearly three shots per game (2.9 blocks in just 24 mpg) … Great awareness of the positioning of opposing defenses as he is always finding himself on the receiving end of lobs … Strong finisher above the rim … Great touch around the rim, shooting a remarkable 72% from the field heading into the Final Four … Great free-throw shooter for a player of his size (75%) suggest he could expand his range out past the charity stripe with a few years of development on his jumper … Crashes the glass with strength and length with an average of 7.5 per game in just 24 minutes … Led the country in Player Efficiency Rating (PER) and posted the 6th best career PER in the NCAA since 2009 … Athletic big man with great footwork who defends the pick-and-roll at an elite level because of it. Uses long arms to disrupt lobs and bounce passes in the lane and create turnovers … Defends at this elite level without fouling as he only averaged 3.4 fouls per 40 minutes … Decent court vision and passer who rarely turns it over with less than one turnover per game … Great frame at 7’0, 243 pounds who will only get stronger as he develops in the NBA … Some teams don’t like to draft big men early because their value has been marginalized to some degree, but Williams is a safe choice to make an impact and carve out a long career as an all-NBA defender with potential to grow offensively … Third on the Duke team in scoring, despite not having many plays calls for him … Started showing some ability to create baskets on the block towards the end of his sophomore year, an intriguing development. Granted a majority of his production came from the fact that 71% of his fgs were assisted plays at the rim …","Yet to show that his range can expand to an NBA level, but free-throw percentage indicates that could improve with a few seasons working on his craft … Can be taken advantage of in isolations against quicker opponents at the next level, but won’t be a total liability considering his good footwork … Doesn’t possess a lot of self-creation or ball-handling skills, but he makes up for it offensively with off-ball movement and positioning … Only one 3-point attempt in his 61-game career with the Blue Devils … Reasonable to expect someone with his size and strength to score more often in the post and/or get to the line against opponents who are, at least the vast majority, are less athletic, smaller and weaker … Averaged just 2 FT per game as a sophomore. Hard to be too critical as he was only able to do what was asked of him within the Duek System, but would love to see him play more physical and get to the line more … Played just 24 minutes per game, after playing just 15 mpg as a freshman. While this makes his numbers more impressive on a per-minute basis, the fact that he played limited minutes draws some questions regarding conditioning and stamina …",85,240,20.53
AJ Griffin,16,"Prototypical size for an NBA wing at 6-6, 220 pounds and a 7-foot wingspan … Great potential as a shooter … Prolific/Dangerous three point shooter, shot 45.4% from range showing a “pure shooting stroke” … Has excellent rotation on his shot … Stays down and in position to go up for a jumper off the catch … Has a very repeatable shot motion … Does an excellent job of staying on balance at all times … Can create space to get his own shot when needed … Good at driving out of a triple threat position … Shows the ability to attack defenses from multiple levels and strings moves together to keep attacks going – doesn’t just stop if a defender cuts off his first look … Has a really good spin move when driving into the paint … Can use some physicality to get to where he wants on the court and create space to get his shot off … Does a good job of keeping the ball away from defenders when going to the rim, making it hard to contest him inside if he has beaten his defender even a little … Has good athleticism, allowing him to finish strong at the rim. Uses his length well defensively …","Despite his great length and athleticism, lacks great foot speed to blow by opponents allowing them to crowd him on the perimeter … Can be a bit slow to react on defense, opening himself up to back cuts … Gets stuck on screens defensively … Was primarily a shooter/scorer for Duke – didn’t produce a lot in other categories. Also benefited being a complementary scorer, not having the same responsibility to carry his team like other top prospects, leaving some questions of how well he can perform in that role … Had some lackluster performances, in particular in Duke’s loss to UNC in the Final Four … Role with Duke expanded as season went along, but seemed to struggle some with how aggressive to be as a shooter … Doesn’t get quite as much lift on his jumper as you might want for the next level … Would like to see him speed up his release just a little to compensate for his lack of lift on jumper … Sometimes picks up his dribble without knowing where he’s going with the ball … Can rock with the ball while dribbling to get a rhythm, which can make him more predictable for high level defenders … Sometimes goes into a triple threat on the catch, allowing the defense to catch up, when he should just get the ball and go with it … Also seems to go side to side instead of trying to blow by defenders in ISO … Stronger attacking when going with his right hand, can look to pull back or go into a hesitation move more when the ball is in his left – A “tell”, allowing defenders to better predict what he’s looking to do … There are concerns about what he’ll give you on nights where he isn’t scoring …",78,220,18.84
Tari Eason,17,"Versatile, athletic forward that can play either forward spot and can guard up to three positions at the next level … A standout on the defensive end … Can really be disruptive defensively by blocking shots (1.1 /game this season) and grabbing steals (1.9/game) … Excellent anticipation and reflexes to make steals … Instinctual player that can wreak havoc in passing lanes … Natural scorer putting up 17 ppg in just 24 minutes per game … Has good footwork on drives to the basket that allows him to react to how defenders are guarding him and still create space to get his shot off … Impressive ball handler for a combo forward allowing him to create scoring opportunities and utilize his athleticism well on drives to the rim … Extremely effective player in transition – always looks to run … Is aggressive in looking to dunk the ball when going to the rim and can elevate without needing an elongated gather … Shows good strength and plays with solid physicality … Creates contact on his drives to the rim, drawing fouls at a high rate and converts on those opportunities, shooting 80% from the free throw line … Has a quick jump that allows him to contest shots that opponents think are open looks … Rebounds the ball well, particularly on the offensive end … Excellent length with a 7-foot wingspan … Quality rebounder, with very solid 6.6 rebounding numbers in limited minutes off the bench .. Showed a willingness to find ways to contribute as a freshman at Cincinnati with more blocks and assists per game than at LSU, despite playing fewer minutes … Shot needs refinement but knocked down 28-78 three pointers for a solid (36%) clip, though on a fairly low volume (0.8/2.4 per game) …","Overall approach and game in need of refinement. At times lacks consistency and makes mental errors … Despite shooting a better percentage from three after transferring to LSU, needs to refine his shot mechanics as he currently shoots from beside his head with a low release point … Can be uncomfortable driving to his left … Often relies on straight line speed and athleticism, to get to his spots … Can be a bit erratic and inconsistent on offense … Was a liability in regards to turnovers with 2.2 per game to just 1.0 assists per game … Turns the ball over on 13.5% of his plays … Relies on teammates to create most of his offense within the half court … Needs to further develop his in-between game so that defenders can’t focus solely on stopping him at the rim …",80,215,21.13
Dalen Terry,18,"Versatile wing with great length and solid agility and athleticism … Unique player who can impact games without scoring … His biggest area of improvement from freshman to sophomore year was his decision making and A/TO ratio going from just above even to nearly 3-to-1 (1.5/1.2 as freshman to 3.9/1.4 as a sophomore) … Length is slightly obscene with an 8’10 standing reach, which is bigger than a number of power forwards … His 7-foot wingspan on a legit 6-7 frame allows him to play a smothering brand of defense and gives him a lot of versatility when combined with his ability to play as a facilitator on the offense end … His length allows him to be a disruptive on ball defender … Strong finisher who had a number of impressive above the rim dunks on the break. Utilizes his great length well … Imaginative playmaker … High level passer with excellent vision to find the open man and make quick decisions and deliver the ball accurately … Moves the ball quickly and anticipates extremely well when a teammate breaks free … Really thrived in the role of finding teammates with passes on backdoor cuts with concise passes … His passing creates scoring opportunities, as well as a high level lob passer to teammates for ally oops … Solid decision maker on the break …  Jumps the passing lanes well using his long arms and anticipation and ignites the break when he gets the pilfer … Has a flare for the dramatic and does not shy away from the limelight … Improved his three point shooting to a solid 36.4%, though on a low volume (28-77) less than one make per game … Confident with the ball in his hands and loves to push the ball up the floor on the break … Excels in attacking the basket on the baseline and often catches opposing guards napping and is able to finish with a highlight dunk … Excellent rebounder for a guard at 4.8 per game … Considered a high character guy that impressed teams at the combine in his interviews …","Offensive game still needs a lot of work … Obviously has a lot of potential as a combo guard that facilitates but struggles to run a team … Plays a little upright with stiff hips and lacks great fluidity in his first step … Plays better in the open floor and needs to work on becoming better facilitating the pick and roll … Must develop his scoring ability … Averaged just 6.6 ppg in two seasons in Tucson … Only averaged 8 points per game as a sophomore on Arizona’s number one seeded tourney team … His shot has improved as evidenced by his 36.4% 3 point clip but still needs work … Shot selection and decision making improved but must continue to get better … Not a good spot up shooter … Really struggles to knock down shots from the mid range … Shot has a lot of motion, and takes a long time to get it off … 68% free throw shooter over Arizona career … Inconsistent shooting motion that breaks down as he gets further away from the basket and needs refinement … Slight hitch in his shooting form. Holds the ball too long instead of releasing as soon as he goes up … Also needs to focus on staying on balance and going up without leaning into his shots … High center of gravity due to long legs seems to affect his balance at times … Footwork needs to be improved … Could use some additional weight on his thin frame … Not the most explosive leaper, but his length allows him to play more athletically … Usually finds a way to get to the basket but will need to develop a floater to become more efficient in order to combat the interior length at the next level …",79,195,19.96
Jake LaRavia,19,"Hard working, versatile forward who shows excellent determination and toughness …  Went from a solid player on a mid major (Indiana State) as a sophomore to transferring to Wake Forest and becoming and standout player on an ACC team … A solid leaper with the ability to throw down dunks on the break and on back door cuts … Solid passer with an unselfish, team approach … A solid shooter in the mid-range on catch and shoot plays … A career 37% three point shooter on 1.5 attempts per game … While not a huge weapon as an outside shooter, the potential is certainly there for him to become one … Despite being a junior, won;t be 21 until November making him young for his grade … Scored a solid 34 inch max vertical at the combine … Shows solid basketball instincts and plays an unselfish brand of ball. Has very good vision and passing skills for a forward at 3.7 assists per game to 2.7 turnovers … Solid though not outstanding on the boards at 6.6 per game. Lack of length hurts his ability to hunt rebounds against longer and more athletic opponents … Has very good instincts and anticipation as his 1.7 steals per game can attest …","Lack of speed makes fully utilizing his skill set a challenge at the NBA level … Unlikely to be able to get by NBA defenders off the dribble … Extremely slow feet will prove to be a big hurdle in defending and creating offense for himself … Benefits from today’s position-less game, however he may struggle as a slow forward lacking great speed on the perimeter and great athleticism and length on the block … Has just a 6’9 wingspan, so getting shots off in the paint could prove to be a challenge for him … A career 74% free throw shooter who has decent but not great touch on his shot. Scoring may be a challenge for him, and as a below average athlete, getting playing time as a defensive liability could prove difficult … 8’8 standing reach is not great for a player with just average leaping ability …",80,225,20.65
Malaki Branham,20,"An athletic three-level scorer who can create points on his own and off the ball … Good body control on drives in the lane … Shot 41% from the perimeter on nearly three attempts per game and his 83% FT suggests that his shooting success should continue at the next level with solid mechanics and a great shooting stroke … Excellent cutter with good court vision on and off the ball … Great ball-handler and finisher at the rim (70% at the rim) … Drives with speed to his right to get around defenders and power to create room for himself when he doesn’t turn the corner … Can also drive to his left, but not with the same speed … Possesses an elite mid-range jumper and can stop on a dime off the dribble at his spots to knock down these jumpers … Good vertical and long arms allow him to score over defenders in the lane and grab rebounds on the wing … Plays with a head on a swivel on the defensive end and knows how to get out in transition … Sees the floor well and uses long strides to get to the other side of the rim on drives to avoid defenders and finish reverse layups because of this vision … Great size for someone who can initiate the offense at 6’5 with long arms, in the range of just under 7′ … Gained confidence as the season went on and seemed to play his best in big games …","Shoots smoothly as a spot-up shooter, but looks less in rhythm shooting off the dribble from the perimeter with a slower motion … Branham is at his best when he doesn’t have time to think and just trusts his mechanics and abilities whether that is shooting before contesting defenders arrive or pulling up in front of on-ball defenders … As efficient as he is as a mid-range scorer, he can tend to settle in this area when he can get to the basket instead where he is a more efficient scorer … Struggles to stay balanced and with his man going around screens on the defensive end … Long arms and athleticism should lead to more disruption defensively and more than just 0.7 steals per game and 0.3 blocks per game … Could struggle with contact-seeking wings as the on-ball defender in the post and on drives …",77,195,19.13
Christian Braun,21,"A 6’7 215 SG/SF with good size, strength and athletic ability for a wing prospect … Competent floor spacer with consistent mechanics and footwork when spotting up (38% 3FG as a Jr., 37% for his career) and takes smart shots within the offensive flow … Was very good in transition as a college player; runs the floor with a purpose and is effective as a shooting valve when trailing … Showed he can handle the ball in the open court in spurts too, and that he can finish above the rim with no problem…Has enough strength and leaping skills to convert through contact with some success too (54% FG inside the arc as a Jr.) … Plays with a good feel for the game; makes timely cuts for easy finishes off the ball and finds open areas along the wing for shot opportunities when the defense collapses … Makes sound reads as a passer (2.8 apg as a Jr,), nothing flashy but is effective making dumpoff passes to bigs and finding open perimeter players via drive and dish … Decisive decision maker and the ball doesn’t stick to him for long … Has a knack for attacking aggressive closeouts and getting to the rim … Competitive with solid activity level; contributes on the glass on both ends (6.5 rpg), fights to get back in position when beat off the bounce or working through screens, and scraps for loose balls … The type of player who contributes in a number of ways, some that may not necessarily show on the stat sheet … Was often asked to match up with perimeter and frontcourt players alike in Kansas’ switch heavy defense (esp this past season) and didn’t back down from the challenge … Has good awareness as an off ball defender; understands how to position himself between ball and man to disrupt passing lanes and come up with deflections … Has shown enough strength and effort to hold up OK at the point of attack as a perimeter defender in the pros as well … Blocked 33 shots as a Jr. (tied for 2nd on the team), a nice number for a wing prospect…Improved his scoring exponentially every season (14 ppg as a Jr.), added polish to his floor game each season … Has experience and championship pedigree; will certainly have coaches and organizations that will be endeared to his skill set and intangibles","Can contribute in a number of ways, but doesn’t truly stand out in any particular skill … More good than bad as a jump shooter, but Braun was inconsistent with it during his career at Kansas despite rarely having to take difficult shots (mostly spot-ups with space) and endured a slump or 2 from deep in each of his last 2 seasons after shooting a scorching 44% from 3 in limited minutes as a Fr … Only OK FT shooter numbers (career 74% FT, 73% as a Jr.) shows that he’s solid but not elite with his shooting touch … Doesn’t always shoot with confidence and passes up open shots occasionally, can be unselfish to a fault … Offers very little in the way of a mid-range game, would help to develop a floater … Pretty bland repertoire of moves and gets stalemated if his initial driving lane is cut off … Mediocre ball-handling ability, not particularly fluid or quick off the dribble … Has the functional size and athleticism for the perimeter, but doesn’t possess the length that would allow the positional versatility and shot-blocking production he showed defensively this past season to translate well to the pros … A capable passer but more within the flow of the offense, does not project as a facilitator or true secondary playmaker who has much offense ran through them at the NBA level … Lacks great length with just a +1 wingspan (6’6.5)  in relation to his height …",79,210,21.2
Walker Kessler,22,"Has excellent size for the position at 7’1”, 245 pounds. He is an elite level shot blocker and shot disruptor inside, routinely blocking 4 or more shots in a game (currently averaging 4.7 per game) … Has nimble feet for a footer … Moves well, is not a statue in the paint, and has shown an ability to step out and defend in pick and roll situations while still being able to recover to his man … Despite being very aggressive looking to block shots, doesn’t pick up a lot of fouls, and does a good job of using verticality instead of swiping at the ball … Deters inside shots just by his mere presence in the paint … Does a good job of making contact with his man when shots go up before going to track down the rebound … Rebounds with two hands routinely … Good at finishing around the rim with dunks and excels at putting himself in position to be a threat in the lob game … Does a very good job in the pick and roll game offensively …","Can get his center of gravity a little too high when switched onto perimeter players, allowing them to get by him more easily … Isn’t much of a jump shooter from outside, making only 21.4% of his threes on 1.5 attempts per game thus far this season … Doesn’t secure the ball very well when posting up offensively, is prone to having it knocked away, resulting in turnovers … Can sometimes try to do too much on the offensive end instead of playing to his strengths … Is a liability anytime he dribbles the basketball … Has the ball knocked out of his hands more than he probably should for a player as strong as he is … Needs to improve his ability to pass out of the post and find open teammates … Is not a good free throw shooter, could improve on his career 61.4% free throw percentage … Despite  his ability to be a rim protector and shot blocker, his ability to switch on defensive assignments and stay in front of opponents when he guards the perimeter will be a challenge for him as a big and less mobile center …",85,255,20.92
David Roddy,23,"Strength-wise a mismatch for other teams, has a combination of size and power that can frustrate smaller forwards and slow big men alike … Has great length with a 6’11 wingspan … Uses his length to his advantage and understands when to post up, pull it out and drive or take a jump shot … Really improved over the past year on his three point shooting and volume, shot extremely well on catch and shoot three pointers which should immediately translate, can really give you offense from anywhere on the floor, proved that he can create his own shot  … Was often featured in ISO situations has real potential as a frustrating mismatch player, isn’t afraid of contact when getting into the paint, really can score from anywhere … Excellent footwork in the post isn’t afraid to back down or turn for a jumper can continue to expand his faceup game but the potential is there, strong with the basketball isn’t afraid to clear his opponent out on the drive, has pick and pop/roll potential and is a good ball handler for his position … Can be either the ball handler or screener, fluid jumper – really consistent form, good cutter with the ability to explode in traffic and off two feet, has the experience to past out of the post and has shown growth passing on the drive or when he stops short in the paint – isn’t afraid to move the ball and trusts his teammates, can improve defensively … Physicality helps him and he competes every possession … Size allows him to also be a good rebounder on both ends 7.5RPG (2 ORB) …","Really struggles with containing opponents defensively with very slow foot speed … Lacks verticality to finish and rebound against bigger opponents … Flat footed, slow hips, hard closeouts all lead to leaving the defenders behind him prone to an attacking player, speed of the game will determine if he can stay on the floor … Could end up in bad fouls from trying to recover or over-committing, not the most laterally quick and crafty guards with a good first step should have no problem getting around him … Big men will be stronger and taller which will allow them to back him down in the post, is going to be a challenge for him to fit into defensive schemes and how often teams are willing to attack him, while he has shown flashes on defense (especially when he walls up) he is going to need to really work on defending both on the perimeter and in the paint, hope for additional discipline on defense, he can continue to tighten his ball handling and play under control when heading toward the rim, to adjust for the speed of the game but has shown he can handle on the outside in college … Undersized, Roddy finding success in the post and additional consistency with volume from beyond the arc will help him gain some NBA minutes …",78,260,21.25
