Name,Pick,Strengths,Weaknesses,Height,Weight,Age
Christian Koloko,33,"A rangy 7’1 220 big man with the length (7’5 wingspan) and mobility to fill a traditional C role at the pro level…Also has the wide shoulders to add muscle to his frame without the loss of athleticism…A late bloomer who had a breakout season as a rim protector and at-the-rim finisher during his Jr season after being a modest contributor early in his career….Steadily learning how to use his length very well to smother players defensively and is a presence penetrators must locate on any slashes or cuts to the paint (nearly 3 BPG as a Jr)…Pretty fluid athlete for his size and can cover massive ground, making him a factor as a shot blocker even in the mid-range area and when switched on smaller players…Has strong hands and does a good job of keeping the ball high on rebounds and finishes, minimizing the chance of players from stripping him of the ball…An outstanding finisher at the rim (63 FG% as a Jr.) and usually looks to dunk the ball with authority in close….Active motor and shows a good nose for the ball on the offensive glass (2.5 ORPG the past 2 seasons); gets his fair share of putbacks and will take advantage if you don’t put a body on him when shots go up…Developing ability to shoot from mid-range is worth keeping an eye on, Koloko is currently more willing to take jumpers than at the beginning of his career…Solid FT % for a C shows potential signs of growth as a face-up threat (73 FT% as a Jr. after modest percentages his 1st 2 seasons)…Improving passer in the low to mid post area, it’s obvious the college game slowed down for him this past season","Needs to add more muscle; can at times get knocked off his pivot by physical defenders at the point of attack…Not much more than a lob threat or rim runner offensively…Becomes much less effective the further he gets away from the rim, doesn’t have the touch to be much of a scoring threat when he has to take shots that aren’t dunks…Very raw post game and has awkward possessions when he can’t simply dunk the ball or if his initial move is cut off…Will take some 12-15 ft shots if the defense gives him room, but is not much a threat as a shooter right now…Inconsistent fundamentally on defense; when he guards players facing him up outside the paint he often comes out of his stance and plays too upright leading to fouls and open driving lanes…Doesn’t contain crossovers and misdirection moves in space well enough to seamlessly adjust to the more switch-heavy principles of most current NBA defenses…Will bite on pump fakes and get overzealous attempting to swat shots…Can be a bit foul prone (2.8 FPG as a Jr.), though to his credit he did improve in that area this past season…A late bloomer but will be 22 on draft night and will have questions about how much further he can develop and improve his skill set",84,220,22.02
Jaylin Williams,34,"A relentless, versatile center who is built for the modern game with his disruptiveness and defensive acumen … Top of the key offensive initiator with great court vision and powerful, accurate passing leading to 2.6 assists per game his sophomore season … High-level athlete who can put the ball on the floor and play mobile on both ends of the floor … Has the potential to expand his range beyond the 3-point line … Boxes out well with the size and length to be a great rebounder … Averaged nearly 10 rebounds per game at Arkansas this season … Extremely smart defender who was the best player in the nation at rotating over and drawing charges … It is an understatement to call him a pesky defender … Defensive versatility is his greatest strength as he can guard just about any player on the floor, allowing his team to switch anything … High motor player who sets the tone defensively and has the stamina to play for long stretches. Averaged nearly 32 minutes per game for the Razorbacks and significantly improved in staying out of foul trouble … Williams fouled nearly five times per 40 minutes as a freshman and reduced this to 3.3 fouls per 40 minutes as a sophomore … Active hands on entry passes … Isn’t afraid to put his body into opponents in the post on both ends … Meets players at the rim as he averaged over a block per game … Creates chaos and turnovers on defense with 54 drawn charges and 48 steals on the season … Showed out against elite big men like Chet Holmgren, Drew Timme and Mark Williams in the NCAA Tournament … Will give you everything he has whenever he is on the floor and simply knows how to win and make players better around him …","Is comfortable shooting on the perimeter and has the potential to be a capable threat, but that won’t come instantly at the next level and will probably need a few years to get to that point … Extremely hesitant to shoot outside of the paint … Averaged nearly two turnovers per game … It’s reasonable to expect more than a block per game from a player who roamed the paint as much as he did, so we might not see the same shot blocking prowess at the next level with longer and stronger athletes … Won’t put up great scoring numbers during his career, as most teams will solely desire his defensive traits and production … Doesn’t fear contact but could still get a little stronger …",82,235,20.0
Max Christie,35,"A sweet shooting, slender 6’5 190 wing with decent length and the frame to add on more muscle … Adequate quickness and leaping ability as an athlete … Has the raw ability to score the ball in a few different ways, and tends to be most effective off the dribble looking to convert baskets from the 15-18 ft area … Is active and savvy without the ball; got a decent amount of easy shots at the rim just by running the floor in transition, awareness on the offensive glass and making smart cuts to openings in the defense …  Also utilizes screens well to get space and rise up into pull-up jumpers or get into the lane with floaters/runners when he can’t get all the way to the rim …. A right-handed player who seems to favor going left … Good rhythm shooter with a high release that he uses to shoot over smaller players well, and has 3-point range that is still developing consistency … Occasionally showed flashes of being able to hit shots from deep off the dribble too … Was an 82% FT shooter as a Fr., illustrating solid shooting touch … A willing defender, had some success on that end as a Fr. in a tough, veteran league like the Big 10 … Had 4 games with multiples blocked shots as a Fr., which is good for a guard prospect…Has earned praise for being very coachable in HS, AAU and in his lone collegiate season at Michigan State … Still very early in his development stages and would be a teenager through about half of the NBA season schedule as a rookie …","Needs to fill out his frame and get stronger, didn’t quite have the necessary physical or athletic traits to overcome his lack of strength consistently at the college level … Didn’t get into the paint or to the FT line much (2.1 FTA per game) this past season … Average ball-handler who doesn’t have a 2nd gear to cleanly blow by perimeter defenders & sometimes even your more athletic frontcourt match ups that he had in switches on an island, and in turn attempts a high number of contested jump shots leading to inefficiency (38% FG, 31% 3FG as a Fr.) … Settles more than some would like shot selection wise, and never quite seemed to be consistently within the flow of Michigan State’s offense last season … Not a natural playmaker (even 1.5 A/TO as a Fr.); tended to be overly deliberate in his approach with the ball in his hands offensively, making him easier to guard when advanced scouting and noticed tendencies came into play as the season progressed … The ability to hit the open man more when reading help defense would go a long way in opening up his offensive game … More steady than disruptive defensively … Had average production across the board for a draft prospect despite playing extended time (9.3 ppg, 3.5 rpg in 30 mpg), and isn’t truly special in any one particular element of the game currently … A green player who has the groundwork to be effective in a few skills but needs time and polish to get there …",77,190,19.38
Gabriele Procida,36,"Athletic wing with good size… Above average length, with a measured 6-8 wingspan… Above average basketball I.Q… Good athlete, with some sneaky athleticism… Great leaper off one foot… Loves to run in transition… Effective finisher at the rim in transition… Has all the necessary elements to become a 3-and-D wing… Possesses a quick (not explosive) first step… Efficient on the offensive end, doesn’t try to do too many things, playing within his role… Very Good shooter in Spot Up situations and above average in off screen actions… Knows his way around screens, he can do some flare or curls when he is taking a screen off-ball actions… Solid ball handler, can score an occasional Pull-Up , or a shot off dribble with a step back… Relentless in off-ball actions, he moves all the time trying to find a gap on defense… Good cutter from the weak side… Has shown some potential as a passer in drive and kick actions… Excels on the open floor, either as the ball handler, or running in the wings… Crashes the offensive boards, trying to surprise his opponent… Good lateral quickness… Versatile defender, he could potential guard all perimeter positions… Aggressive on ball defender, has active hands that help him make steals… Feels the passing lanes and makes steals… Good help defender, either from the strong or the weak side","He might be a little undersized for a small forward, but not polished enough to play as a shooting guard… Not an elite athlete… His athleticism takes a small hit when the game slows down, since he needs room to gather before jumping… Must add muscle on his upper body… Should continue working his ball handling, especially with his weak (left) hand if he wants to play as a shooting guard… Can’t really create his shot with consistency, he is more of a “Catch and Shoot/Catch and Drive” wing… Inefficient in Catch and Drives, doesn’t finish plays with confidence… Must work on his finishes with his left hand… Doesn’t really absorb contact well when finishing at the basket due to lack of strength on the upper body… He should add a Post Up game in his arsenal to be able to punish miss-matches… At times he just moves too much on offense, crowding his teammates and creating spacing issues for his team… Needs to work his game in Pick and Roll situations, not really a facilitator at this point of his development… Average passer, doesn’t always read the game right… He should improve as a shooter in Pull Ups to expand his game more… He gambles on defense for steal, leaving his team vulnerable… Has problems covering big, athletic wings",79,195,20.07
Jaden Hardy,37,"A highly touted recruit who chose to play with the G League Ignite instead of going to college … Technically sound shooter who can score at all three levels … Finishes through contact at an elite level at the rim and really knows how to create space for himself on the perimeter … Can drive to either side and finish with either hand around the rim … His slashing ability is the biggest strength of his offensive game … Impressive lateral movement as a defender who shows instinctive help defense and tremendous recovery ability. Commonly disruptive as a help defender who generates a ton of steals … Streaky shooter who can let it fly from anywhere on the floor when he is in a groove … Great athlete who uses his speed and aggressiveness to his advantage attacking the rim … Shows flashes of good court vision and playmaking ability, but is undoubtedly a scorer first … Good size for a combo guard who knows how to get his own shot. Elite change of pace athlete who can cross up defenders and break ankles with a quick twitch stepback jumper and elite shooting range … Field goal percentage and 3-point percentage jumped from 35/27 to 40/33 from the Showcase to the Ignite Tour showing his improvement as his comfort level increased playing professionally … Nearly an 80% shooter at the line in 25 games indicates his jumper will only improve in time … At worst Hardy will be a streaky shooter and scorer  …  Will only be 20-years old with professional experience on draft night … Sneaky athleticism with the ability to play above the rim at times, when he gets an open lane to the basket …","A disappointing season with the G-League Ignite has dropped Hardy from a projected mid lottery selection to a likely mid-late first round pick … Offensively can be a bit predictable as a straight line driver, lacking the wiggle and moves to get by opponents in ISO situations … Can over-commit at times trying to create steals leaving his man wide open … Decision making and feel for the game still in need of refinement … Throws up some wild shots at times and can play a bit out of control on the drive picking up his dribble too early at times … His over-confidence leads to a lot of drives without a real plan making him extremely turnover prone … Shooting efficiency left a lot to be desired during his G-League campaign, but his development could be seen as the season went on and he started to improve … Teams on the outskirts of the lottery might be looking for a contributing player instead of an upside prospect/project, which could cause Hardy to stay on the board for longer on draft night …  Appears to be a bit undersized at closer to 6-4, but has a solid wingspan in the 6-9 range …",76,200,19.98
Kennedy Chandler,38,"A lightning quick guard who improved dramatically throughout his freshman season at Tennessee … Creates a ton of space for himself on the drive with a lightning fast first step and great speed when he gets downhill … Very good mid range shooter and implements a runner well to compensate for his lack of finishing ability at the rim … Became much more confident in his 3-point jumper as the season went on, which brought the most out of him as a slasher and playmaker as well. Shot 57% from the perimeter in the month of March on over four attempts per game … Accurate and crafty passer who is deadly passing to cutting wings and big men in the paint … The Volunteers used a lot of two-big lineups and Chandler frequently found space for one of them to finish at the rim … High level finisher around big men when he is driving to the rim … Capable of leaping above the rim to block shots from behind and contest big men at the rim from help positions … Good anticipation defensively as he averaged over two steals per game on the season, with most coming from jumping passing lanes and scoring in transition … Disruptive defender on and off the ball who can speed up opponents and generate turnovers … Runs the offense with poise and pace and can adjust based on the flow of the game … His speed and shooting give him nice potential and he should benefit from an extremely weak PG class in 2022 … Still only 19 years-old and a solid end to the season could put him in the lottery discussion especially for teams willing to be patient with his transition to the professional game","Small for a point guard in today’s NBA at 6’1 in shoes despite the solid wingspan (6’5) … On top of his lack of size, has a slight frame making him a bit of a liability on the defensive end … Free throw shooting is a major problem for a point guard who loves to get to the basket and create contact on drives … Chandler only shot 60% on three FT attempts per game, which is not only a problem for wasting possessions when getting to the line, but could suggest his 3-point percentage could be sporadic as well … Shooting motion is a little slow, which could force him to create more separation than others need to in isolations and self-creating opportunities … Lack of size at only 6’ feet is also problematic … Slow adjustment to the college game suggests it could take a few years for him to get accustomed to the professional game, as more successful college guards in previous years have needed adjustment time during their transition … Patience and trust will be needed from the team that drafts him, but Chandler’s intangibles and potential should help them reap the benefits whenever he gets comfortable in the pros … Played off the ball for a lot of freshman season, but it shouldn’t be a big detriment to his draft stock or future as a lead guard as he’s proven in multiple settings that he has lead guard skills …",73,170,19.78
Khalifa Diop,39,"Athletic, blue collar big… Has prototypical size and length for a center… Above average wingspan, measured at 7-2 feet… Good athlete… Has already an NBA body… Has a strong torso and upper body… Above average basketball I.Q… Plays with a good motor… Good leaper off two feet… Good, quick second jump… Runs the floor well… Very good in transition… Good screener and roller in Pick and Roll, he does good Pick and Dives, rolling hard to the basket… Had some good moments in Short Rolls, taking his time before deciding whether to pass or shoot… Good finisher around the rim, likes to finish plays strong… Fights in the post to establish position, doesn’t shy away from contact… Has above average footwork in the Post, prefers to turn on his left shoulder, but he can do an occasional Up and Under… Has shown some glimpses as a shooter from mid-range… High shooting release point in his Jump Shot makes it difficult to get blocked… Above average passer, especially when posting up… Very good offensive rebounder, giving second chance opportunities to his team… Draws a lot of fouls due to playing style, putting pressure on his opponents… Not afraid to bang bodies in the Post when defending… Above average lateral quickness… Good defender in Pick and Roll in drop, flat or hedge out coverage and above average in switches thanks to his nice lateral quickness… Good rim protector, know the low of verticality …","Not an elite athlete… Needs time to gather before a jump, losing time when he tries to elevate from the floor… He is still kind of raw and needs more polishing in his game overall… Inexperienced, hasn’t had enough playing time on high level… He can’t fully control his body yet… Doesn’t have soft hands, ,which kind of limits him, since he loses control of the ball in Pick and Rolls, comitting turnovers… Extremely right hand dominant, really prefers to turn on his left shoulder when Posting Up, something that makes him predictable… Must improve finishing with his left hand at the rim… Face Up game in the post needs work, looks like he lacks confidence to attack consistently in these situations… Inconsistent shooter from mid-range… Bad free throw shooter despite the potential he has shown as a shooter from mid-range… Decision making isn’t there yet when Posting up, he might rush things or make poor passes… Doing Short Rolls in Pick and Roll situations is still a work in progress… Foul prone, he commits too many of them due to either inexperience or his over willingness to help… Surprisingly average shot blocker despite his physical profile and instincts… Lateral quickness not totally there, he could have problems guarding Stretch-Bigs …",83,230,20.45
Bryce McGowens,40,"A lanky 6’6 180 SG prospect with some interesting traits and untapped potential in his physical profile and overall floor game…A long striding athlete who covers ground well and shows pretty good explosiveness and leaping ability with the potential to add more juice once he gets stronger…Intriguing scoring package (nearly 17 ppg as a Fr), shows signs that he could become a dangerous weapon putting the ball in the hoop from all 3 levels of the court…Soft shooting touch and has shown some impressive flashes as a natural shot-maker, particularly off the dribble…Has developing 3-point range off the bounce and as a floor spacer; deep jumper is not as broken as his efficiency may indicate…Pretty good ball-handler with a rangy and deceptive 1st step to turn the corner and get into the lane…Will slither and contort his slender frame into tight spaces and make tricky shots in the lane at times…Is comfortable creating for himself with the use of on-ball screens…Uses defenders aggressiveness against them and has a nice feel for creating space to get into his floaters and pull-up jumpers in rhythm from mid-range…Can effectively switch his pace and uses head fakes & hesitation moves to freeze defenders and draw fouls when he has his man on his hip (over 6 FT/game on an excellent 83% clip)…Plays above the rim with ease in the open court and occasionally with a head of steam going downhill against set defenses; has physical tools that are tailor-made for transition play…Uses his length and leaping skills to contribute on the glass (5.2 rpg)…Gained experience going up against defenses that showed him extra attention in their gameplans on a nightly basis as a Fr., which doesn’t hurt his development in the grand scheme…Not yet the sum of his parts, could just be scratching the surface of his potential","A bit light in the britches; lacks strength and toughness at the current stage and even at the college level it had a noticeable impact on his effectiveness on both ends of the court…Base strength especially needs improvement, can struggle getting his legs underneath himself which leads to his shots falling short and off-balanced attempts off the dribble…Showed spotty shot selection (40% FG) as a Fr., tends to settle and hoisted up some questionable shots early in the shot clock quite a bit…Gets tunnel vision offensively (1.4/2.1 A/TO); played hero ball (out of necessity at times) and missed open teammates routinely when slashing…Was a bit of a “feast or famine” type player from game to game this past season, and many noticed that he generally struggled mightily with his efficiency when he played against the quality teams on Nebraska’s schedule…Doesn’t have the quickest or highest release at the moment, though his size allows him some leeway shooting over closeouts…Would have to greatly increase his shooting efficiency at the next level (27% 3FG) to justify some of the shots he takes…Feel for the game and overall awareness on the court are a work in progress…Tends to easily get bottled up by physical players, can be forced into stagnant possessions and turnovers when defenders pressure him with the ball…Gets pushed around and washed out of plays defensively right now, showing minimal interest fighting through contact on that side of the floor…A poor defender on a bad defensive team in college, had all kinds of issues containing dribble penetration and backdoor plays alike…Often does himself little favors with his underwhelming fundamentals and activity level on that end; doesn’t get into a stance consistently and the high center of gravity he plays with is an issue when he has to defend quick perimeter players in space…More foul prone than your usual guard prospect (2 fouls per game as a Fr.), gets handsy and starts reaching when he gets beat off the bounce…Can be a phantom on the court when he has an off shooting night, often doesnt contribute much outside of scoring currently",78,180,19.64
